Sheet: Planilha2
A1: id | B1: alimento | C1: kcal | D1: proteina | E1: lipideo | F1: carbohidrato | G1: fibra | H1: calcio_mg
A2: 1 | B2: Abacate, cru | C2: 96 | D2: 1 | E2: 8 | F2: 6 | G2: 6 | H2: 7
A3: =R[-1]C+1 -> 2 | B3: Abacaxi, cru | C3: 48 | D3: 0 | E3: 0 | F3: 12 | G3: 0 | H3: 22
A4: =R[-1]C+1 -> 3 | B4: Abacaxi, polpa, congelada | C4: 30 | D4: 0 | E4: 0 | F4: 7 | G4: 0 | H4: 13
A5: =R[-1]C+1 -> 4 | B5: Abadejo, filé, congelado, assado | C5: 111 | D5: 23 | E5: 1 | F5: 0 | G5: 0 | H5: 22
A6: =R[-1]C+1 -> 5 | B6: Abadejo, filé, congelado, cru | C6: 59 | D6: 13 | E6: 0 | F6: 0 | G6: 0 | H6: 10
A7: =R[-1]C+1 -> 6 | B7: Abadejo, filé, congelado, grelhado | C7: 129 | D7: 27 | E7: 1 | F7: 0 | G7: 0 | H7: 20
A8: =R[-1]C+1 -> 7 | B8: Abadejo, filé, congelado,cozido | C8: 91 | D8: 19 | E8: 0 | F8: 0 | G8: 0 | H8: 16
A9: =R[-1]C+1 -> 8 | B9: Abiu, cru | C9: 62 | D9: 0 | E9: 0 | F9: 14 | G9: 1 | H9: 5
A10: =R[-1]C+1 -> 9 | B10: Abóbora, cabotian, cozida | C10: 48 | D10: 1 | E10: 0 | F10: 10 | G10: 2 | H10: 7
A11: =R[-1]C+1 -> 10 | B11: Abóbora, cabotian, crua | C11: 38 | D11: 1 | E11: 0 | F11: 8 | G11: 2 | H11: 17
A12: =R[-1]C+1 -> 11 | B12: Abóbora, menina brasileira, crua | C12: 13 | D12: 0 | E12: 0 | F12: 3 | G12: 1 | H12: 8
A13: =R[-1]C+1 -> 12 | B13: Abóbora, moranga, crua | C13: 12 | D13: 0 | E13: 0 | F13: 2 | G13: 1 | H13: 3
A14: =R[-1]C+1 -> 13 | B14: Abóbora, moranga, refogada | C14: 29 | D14: 0 | E14: 0 | F14: 5 | G14: 1 | H14: 19
A15: =R[-1]C+1 -> 14 | B15: Abóbora, pescoço, crua | C15: 24 | D15: 0 | E15: 0 | F15: 6 | G15: 2 | H15: 8
A16: =R[-1]C+1 -> 15 | B16: Abobrinha, italiana, cozida | C16: 15 | D16: 1 | E16: 0 | F16: 2 | G16: 1 | H16: 16
A17: =R[-1]C+1 -> 16 | B17: Abobrinha, italiana, crua | C17: 19 | D17: 1 | E17: 0 | F17: 4 | G17: 1 | H17: 15
A18: 17 | B18: Abobrinha, italiana, refogada | C18: 24 | D18: 1 | E18: 0 | F18: 4 | G18: 1 | H18: 20
A19: =R[-1]C+1 -> 18 | B19: Abobrinha, paulista, crua | C19: 30 | D19: 0 | E19: 0 | F19: 7 | G19: 2 | H19: 18
A20: =R[-1]C+1 -> 19 | B20: Açaí, polpa, com xarope de guaraná e glucose | C20: 110 | D20: 0 | E20: 3 | F20: 21 | G20: 1 | H20: 22
A21: =R[-1]C+1 -> 20 | B21: Açaí, polpa, congelada | C21: 58 | D21: 0 | E21: 3 | F21: 6 | G21: 2 | H21: 35
A22: =R[-1]C+1 -> 21 | B22: Acarajé | C22: 289 | D22: 8 | E22: 19 | F22: 19 | G22: 9 | H22: 124
A23: =R[-1]C+1 -> 22 | B23: Acelga, crua | C23: 20 | D23: 1 | E23: 0 | F23: 4 | G23: 1 | H23: 42
A24: =R[-1]C+1 -> 23 | B24: Acerola, crua | C24: 33 | D24: 0 | E24: 0 | F24: 7 | G24: 1 | H24: 12
A25: =R[-1]C+1 -> 24 | B25: Acerola, polpa, congelada | C25: 21 | D25: 0 | E25: 0 | F25: 5 | G25: 0 | H25: 7
A26: =R[-1]C+1 -> 25 | B26: Achocolatado, pó | C26: 401 | D26: 4 | E26: 2 | F26: 91 | G26: 3 | H26: 44
A27: =R[-1]C+1 -> 26 | B27: Açúcar, cristal | C27: 386 | D27: 0 | E27: 0 | F27: 99 | G27: 0 | H27: 7
A28: =R[-1]C+1 -> 27 | B28: Açúcar, mascavo | C28: 368 | D28: 0 | E28: 0 | F28: 94 | G28: 0 | H28: 126
A29: =R[-1]C+1 -> 28 | B29: Açúcar, refinado | C29: 386 | D29: 0 | E29: 0 | F29: 99 | G29: 0 | H29: 3
A30: =R[-1]C+1 -> 29 | B30: Agrião, cru | C30: 16 | D30: 2 | E30: 0 | F30: 2 | G30: 2 | H30: 132
A31: =R[-1]C+1 -> 30 | B31: Aipo, cru | C31: 19 | D31: 0 | E31: 0 | F31: 4 | G31: 0 | H31: 65
A32: =R[-1]C+1 -> 31 | B32: Alface, americana, crua | C32: 8 | D32: 0 | E32: 0 | F32: 1 | G32: 1 | H32: 14
A33: =R[-1]C+1 -> 32 | B33: Alface, crespa, crua | C33: 10 | D33: 1 | E33: 0 | F33: 1 | G33: 1 | H33: 37
A34: =R[-1]C+1 -> 33 | B34: Alface, lisa, crua | C34: 13 | D34: 1 | E34: 0 | F34: 2 | G34: 2 | H34: 27
A35: =R[-1]C+1 -> 34 | B35: Alface, roxa, crua | C35: 12 | D35: 0 | E35: 0 | F35: 2 | G35: 2 | H35: 33
A36: =R[-1]C+1 -> 35 | B36: Alfavaca, crua | C36: 29 | D36: 2 | E36: 0 | F36: 5 | G36: 4 | H36: 258
A37: =R[-1]C+1 -> 36 | B37: Alho, cru | C37: 113 | D37: 7 | E37: 0 | F37: 23 | G37: 4 | H37: 13
A38: =R[-1]C+1 -> 37 | B38: Alho-poró, cru | C38: 31 | D38: 1 | E38: 0 | F38: 6 | G38: 2 | H38: 33
A39: =R[-1]C+1 -> 38 | B39: Almeirão, cru | C39: 18 | D39: 1 | E39: 0 | F39: 3 | G39: 2 | H39: 19
A40: =R[-1]C+1 -> 39 | B40: Almeirão, refogado | C40: 65 | D40: 1 | E40: 4 | F40: 5 | G40: 3 | H40: 63
A41: =R[-1]C+1 -> 40 | B41: Ameixa, calda, enlatada | C41: 182 | D41: 0 | E41: 0 | F41: 46 | G41: 0 | H41: 13
A42: =R[-1]C+1 -> 41 | B42: Ameixa, crua | C42: 52 | D42: 0 | E42: 0 | F42: 13 | G42: 2 | H42: 5
A43: =R[-1]C+1 -> 42 | B43: Ameixa, em calda, enlatada, drenada | C43: 177 | D43: 1 | E43: 0 | F43: 47 | G43: 4 | H43: 39
A44: =R[-1]C+1 -> 43 | B44: Amêndoa, torrada, salgada | C44: 580 | D44: 18 | E44: 47 | F44: 29 | G44: 11 | H44: 236
A45: =R[-1]C+1 -> 44 | B45: Amendoim, grão, cru | C45: 544 | D45: 27 | E45: 43 | F45: 20 | G45: 8 | H45: 0
A46: =R[-1]C+1 -> 45 | B46: Amendoim, torrado, salgado | C46: 605 | D46: 22 | E46: 53 | F46: 18 | G46: 7 | H46: 39
A47: =R[-1]C+1 -> 46 | B47: Apresuntado | C47: 128 | D47: 13 | E47: 6 | F47: 2 | G47: 0 | H47: 22
A48: =R[-1]C+1 -> 47 | B48: Arroz carreteiro | C48: 153 | D48: 10 | E48: 7 | F48: 11 | G48: 1 | H48: 13
A49: =R[-1]C+1 -> 48 | B49: Arroz, integral, cozido | C49: 123 | D49: 2 | E49: 1 | F49: 25 | G49: 2 | H49: 5
A50: =R[-1]C+1 -> 49 | B50: Arroz, integral, cru | C50: 359 | D50: 7 | E50: 1 | F50: 77 | G50: 4 | H50: 7
A51: =R[-1]C+1 -> 50 | B51: Arroz, tipo 1, cozido | C51: 128 | D51: 2 | E51: 0 | F51: 28 | G51: 1 | H51: 3
A52: =R[-1]C+1 -> 51 | B52: Arroz, tipo 1, cru | C52: 357 | D52: 7 | E52: 0 | F52: 78 | G52: 1 | H52: 4
A53: =R[-1]C+1 -> 52 | B53: Arroz, tipo 2, cozido | C53: 130 | D53: 2 | E53: 0 | F53: 28 | G53: 1 | H53: 3
A54: =R[-1]C+1 -> 53 | B54: Arroz, tipo 2, cru | C54: 358 | D54: 7 | E54: 0 | F54: 78 | G54: 1 | H54: 4
A55: =R[-1]C+1 -> 54 | B55: Atemóia, crua | C55: 96 | D55: 0 | E55: 0 | F55: 25 | G55: 2 | H55: 22
A56: =R[-1]C+1 -> 55 | B56: Atum, conserva em óleo | C56: 165 | D56: 26 | E56: 5 | F56: 0 | G56: 0 | H56: 6
A57: =R[-1]C+1 -> 56 | B57: Atum, fresco, cru | C57: 117 | D57: 25 | E57: 0 | F57: 0 | G57: 0 | H57: 6
A58: =R[-1]C+1 -> 57 | B58: Aveia, flocos, crua | C58: 393 | D58: 13 | E58: 8 | F58: 66 | G58: 9 | H58: 47
A59: =R[-1]C+1 -> 58 | B59: Azeite, de dendê | C59: 884 | D59: 0 | E59: 100 | F59: 0 | G59: 0 | H59: 0
A60: =R[-1]C+1 -> 59 | B60: Azeite, de oliva, extra virgem | C60: 884 | D60: 0 | E60: 100 | F60: 0 | G60: 0 | H60: 0
A61: =R[-1]C+1 -> 60 | B61: Azeitona, preta, conserva | C61: 194 | D61: 1 | E61: 20 | F61: 5 | G61: 4 | H61: 58
A62: =R[-1]C+1 -> 61 | B62: Azeitona, verde, conserva | C62: 136 | D62: 0 | E62: 14 | F62: 4 | G62: 3 | H62: 45
A63: =R[-1]C+1 -> 62 | B63: Bacalhau, salgado, cru | C63: 135 | D63: 29 | E63: 1 | F63: 0 | G63: 0 | H63: 156
A64: =R[-1]C+1 -> 63 | B64: Bacalhau, salgado, refogado | C64: 139 | D64: 23 | E64: 3 | F64: 1 | G64: 0 | H64: 59
A65: =R[-1]C+1 -> 64 | B65: Baião de dois, arroz e feijão-de-corda | C65: 135 | D65: 6 | E65: 3 | F65: 20 | G65: 5 | H65: 33
A66: =R[-1]C+1 -> 65 | B66: Banana, da terra, crua | C66: 128 | D66: 1 | E66: 0 | F66: 33 | G66: 1 | H66: 4
A67: =R[-1]C+1 -> 66 | B67: Banana, doce em barra | C67: 280 | D67: 2 | E67: 0 | F67: 75 | G67: 3 | H67: 11
A68: =R[-1]C+1 -> 67 | B68: Banana, figo, crua | C68: 105 | D68: 1 | E68: 0 | F68: 27 | G68: 2 | H68: 6
A69: =R[-1]C+1 -> 68 | B69: Banana, maçã, crua | C69: 86 | D69: 1 | E69: 0 | F69: 22 | G69: 2 | H69: 3
A70: =R[-1]C+1 -> 69 | B70: Banana, nanica, crua | C70: 91 | D70: 1 | E70: 0 | F70: 23 | G70: 1 | H70: 3
A71: =R[-1]C+1 -> 70 | B71: Banana, ouro, crua | C71: 112 | D71: 1 | E71: 0 | F71: 29 | G71: 1 | H71: 3
A72: =R[-1]C+1 -> 71 | B72: Banana, pacova, crua | C72: 77 | D72: 1 | E72: 0 | F72: 20 | G72: 2 | H72: 5
A73: =R[-1]C+1 -> 72 | B73: Banana, prata, crua | C73: 98 | D73: 1 | E73: 0 | F73: 25 | G73: 2 | H73: 7
A74: =R[-1]C+1 -> 73 | B74: Barreado | C74: 164 | D74: 18 | E74: 9 | F74: 0 | G74: 0 | H74: 14
A75: =R[-1]C+1 -> 74 | B75: Batata, baroa, cozida | C75: 80 | D75: 0 | E75: 0 | F75: 18 | G75: 1 | H75: 11
A76: =R[-1]C+1 -> 75 | B76: Batata, baroa, crua | C76: 100 | D76: 1 | E76: 0 | F76: 23 | G76: 2 | H76: 17
A77: =R[-1]C+1 -> 76 | B77: Batata, doce, cozida | C77: 76 | D77: 0 | E77: 0 | F77: 18 | G77: 2 | H77: 17
A78: =R[-1]C+1 -> 77 | B78: Batata, doce, crua | C78: 118 | D78: 1 | E78: 0 | F78: 28 | G78: 2 | H78: 21
A79: =R[-1]C+1 -> 78 | B79: Batata, frita, tipo chips, industrializada | C79: 542 | D79: 5 | E79: 36 | F79: 51 | G79: 2 | H79: 11
A80: =R[-1]C+1 -> 79 | B80: Batata, inglesa, cozida | C80: 51 | D80: 1 | E80: 0 | F80: 11 | G80: 1 | H80: 3
A81: =R[-1]C+1 -> 80 | B81: Batata, inglesa, crua | C81: 64 | D81: 1 | E81: 0 | F81: 14 | G81: 1 | H81: 3
A82: =R[-1]C+1 -> 81 | B82: Batata, inglesa, frita | C82: 267 | D82: 4 | E82: 13 | F82: 35 | G82: 8 | H82: 6
A83: =R[-1]C+1 -> 82 | B83: Batata, inglesa, sauté | C83: 67 | D83: 1 | E83: 0 | F83: 14 | G83: 1 | H83: 4
A84: =R[-1]C+1 -> 83 | B84: Bebida isotônica, sabores variados | C84: 25 | D84: 0 | E84: 0 | F84: 6 | G84: 0 | H84: 1
A85: =R[-1]C+1 -> 84 | B85: Bebida láctea, pêssego | C85: 55 | D85: 2 | E85: 1 | F85: 7 | G85: 0 | H85: 88
A86: =R[-1]C+1 -> 85 | B86: Berinjela, cozida | C86: 18 | D86: 0 | E86: 0 | F86: 4 | G86: 2 | H86: 10
A87: =R[-1]C+1 -> 86 | B87: Berinjela, crua | C87: 19 | D87: 1 | E87: 0 | F87: 4 | G87: 2 | H87: 9
A88: =R[-1]C+1 -> 87 | B88: Beterraba, cozida | C88: 32 | D88: 1 | E88: 0 | F88: 7 | G88: 1 | H88: 15
A89: =R[-1]C+1 -> 88 | B89: Beterraba, crua | C89: 48 | D89: 1 | E89: 0 | F89: 11 | G89: 3 | H89: 18
A90: =R[-1]C+1 -> 89 | B90: Bife à cavalo, com contra filé | C90: 291 | D90: 23 | E90: 21 | F90: 0 | G90: 0 | H90: 25
A91: =R[-1]C+1 -> 90 | B91: Biscoito, doce, maisena | C91: 442 | D91: 8 | E91: 11 | F91: 75 | G91: 2 | H91: 54
A92: =R[-1]C+1 -> 91 | B92: Biscoito, doce, recheado com chocolate | C92: 471 | D92: 6 | E92: 19 | F92: 70 | G92: 2 | H92: 27
A93: =R[-1]C+1 -> 92 | B93: Biscoito, doce, recheado com morango | C93: 471 | D93: 5 | E93: 19 | F93: 71 | G93: 1 | H93: 35
A94: =R[-1]C+1 -> 93 | B94: Biscoito, doce, wafer, recheado de chocolate | C94: 502 | D94: 5 | E94: 24 | F94: 67 | G94: 1 | H94: 23
A95: =R[-1]C+1 -> 94 | B95: Biscoito, doce, wafer, recheado de morango | C95: 513 | D95: 4 | E95: 26 | F95: 67 | G95: 0 | H95: 13
A96: =R[-1]C+1 -> 95 | B96: Biscoito, polvilho doce | C96: 437 | D96: 1 | E96: 12 | F96: 80 | G96: 1 | H96: 30
A97: =R[-1]C+1 -> 96 | B97: Biscoito, salgado, cream cracker | C97: 431 | D97: 10 | E97: 14 | F97: 68 | G97: 2 | H97: 20
A98: =R[-1]C+1 -> 97 | B98: Bolinho de arroz | C98: 273 | D98: 8 | E98: 8 | F98: 41 | G98: 2 | H98: 23
A99: =R[-1]C+1 -> 98 | B99: Bolo, mistura para | C99: 418 | D99: 6 | E99: 6 | F99: 84 | G99: 1 | H99: 58
A100: =R[-1]C+1 -> 99 | B100: Bolo, pronto, aipim | C100: 323 | D100: 4 | E100: 12 | F100: 47 | G100: 0 | H100: 85
A101: =R[-1]C+1 -> 100 | B101: Bolo, pronto, chocolate | C101: 410 | D101: 6 | E101: 18 | F101: 54 | G101: 1 | H101: 74
A102: =R[-1]C+1 -> 101 | B102: Bolo, pronto, coco | C102: 333 | D102: 5 | E102: 11 | F102: 52 | G102: 1 | H102: 57
A103: =R[-1]C+1 -> 102 | B103: Bolo, pronto, milho | C103: 311 | D103: 4 | E103: 12 | F103: 45 | G103: 0 | H103: 82
A104: =R[-1]C+1 -> 103 | B104: Brócolis, cozido | C104: 24 | D104: 2 | E104: 0 | F104: 4 | G104: 3 | H104: 50
A105: =R[-1]C+1 -> 104 | B105: Brócolis, cru | C105: 25 | D105: 3 | E105: 0 | F105: 4 | G105: 2 | H105: 85
A106: =R[-1]C+1 -> 105 | B106: Cação, posta, com farinha de trigo, frita | C106: 208 | D106: 24 | E106: 9 | F106: 3 | G106: 0 | H106: 30
A107: =R[-1]C+1 -> 106 | B107: Cação, posta, cozida | C107: 116 | D107: 25 | E107: 0 | F107: 0 | G107: 0 | H107: 10
A108: =R[-1]C+1 -> 107 | B108: Cação, posta, crua | C108: 83 | D108: 17 | E108: 0 | F108: 0 | G108: 0 | H108: 8
A109: =R[-1]C+1 -> 108 | B109: Cacau, cru | C109: 74 | D109: 0 | E109: 0 | F109: 19 | G109: 2 | H109: 12
A110: =R[-1]C+1 -> 109 | B110: Café, infusão 10% | C110: 9 | D110: 0 | E110: 0 | F110: 1 | G110: 0 | H110: 3
A111: =R[-1]C+1 -> 110 | B111: Café, pó, torrado | C111: 418 | D111: 14 | E111: 11 | F111: 65 | G111: 51 | H111: 106
A112: =R[-1]C+1 -> 111 | B112: Cajá, polpa, congelada | C112: 26 | D112: 0 | E112: 0 | F112: 6 | G112: 1 | H112: 9
A113: =R[-1]C+1 -> 112 | B113: Cajá-Manga, cru | C113: 45 | D113: 1 | E113: 0 | F113: 11 | G113: 2 | H113: 12
A114: =R[-1]C+1 -> 113 | B114: Caju, cru | C114: 43 | D114: 0 | E114: 0 | F114: 10 | G114: 1 | H114: 1
A115: =R[-1]C+1 -> 114 | B115: Caju, polpa, congelada | C115: 36 | D115: 0 | E115: 0 | F115: 9 | G115: 0 | H115: 0
A116: =R[-1]C+1 -> 115 | B116: Caju, suco concentrado, envasado | C116: 45 | D116: 0 | E116: 0 | F116: 10 | G116: 0 | H116: 0
A117: =R[-1]C+1 -> 116 | B117: Caldo de carne, tablete | C117: 240 | D117: 7 | E117: 16 | F117: 15 | G117: 0 | H117: 129
A118: =R[-1]C+1 -> 117 | B118: Caldo de galinha, tablete | C118: 251 | D118: 6 | E118: 20 | F118: 10 | G118: 11 | H118: 16
A119: =R[-1]C+1 -> 118 | B119: Camarão à baiana | C119: 100 | D119: 7 | E119: 5 | F119: 3 | G119: 0 | H119: 42
A120: =R[-1]C+1 -> 119 | B120: Camarão, Rio Grande, grande, cozido | C120: 90 | D120: 18 | E120: 1 | F120: 0 | G120: 0 | H120: 89
A121: =R[-1]C+1 -> 120 | B121: Camarão, Rio Grande, grande, cru | C121: 47 | D121: 9 | E121: 0 | F121: 0 | G121: 0 | H121: 51
A122: =R[-1]C+1 -> 121 | B122: Camarão, Sete Barbas, sem cabeça, com casca, frito | C122: 231 | D122: 18 | E122: 15 | F122: 2 | G122: 0 | H122: 959
A123: =R[-1]C+1 -> 122 | B123: Cana, aguardente 1 | C123: 215 | D123: 0 | E123: 0 | F123: 0 | G123: 0 | H123: 0
A124: =R[-1]C+1 -> 123 | B124: Cana, caldo de | C124: 65 | D124: 0 | E124: 0 | F124: 18 | G124: 0 | H124: 9
A125: =R[-1]C+1 -> 124 | B125: Canjica, branca, crua | C125: 357 | D125: 7 | E125: 0 | F125: 78 | G125: 5 | H125: 1
A126: =R[-1]C+1 -> 125 | B126: Canjica, com leite integral | C126: 112 | D126: 2 | E126: 1 | F126: 23 | G126: 1 | H126: 42
A127: =R[-1]C+1 -> 126 | B127: Capuccino, pó | C127: 417 | D127: 11 | E127: 8 | F127: 73 | G127: 2 | H127: 466
A128: =R[-1]C+1 -> 127 | B128: Caqui, chocolate, cru | C128: 71 | D128: 0 | E128: 0 | F128: 19 | G128: 6 | H128: 17
A129: =R[-1]C+1 -> 128 | B129: Cará, cozido | C129: 77 | D129: 1 | E129: 0 | F129: 18 | G129: 2 | H129: 5
A130: =R[-1]C+1 -> 129 | B130: Cará, cru | C130: 95 | D130: 2 | E130: 0 | F130: 22 | G130: 7 | H130: 3
A131: =R[-1]C+1 -> 130 | B131: Carambola, crua | C131: 45 | D131: 0 | E131: 0 | F131: 11 | G131: 2 | H131: 4
A132: =R[-1]C+1 -> 131 | B132: Caranguejo, cozido | C132: 82 | D132: 18 | E132: 0 | F132: 0 | G132: 0 | H132: 357
A133: =R[-1]C+1 -> 132 | B133: Carne, bovina, acém, moído, cozido | C133: 212 | D133: 26 | E133: 10 | F133: 0 | G133: 0 | H133: 4
A134: =R[-1]C+1 -> 133 | B134: Carne, bovina, acém, moído, cru | C134: 136 | D134: 19 | E134: 5 | F134: 0 | G134: 0 | H134: 2
A135: =R[-1]C+1 -> 134 | B135: Carne, bovina, acém, sem gordura, cozido | C135: 214 | D135: 27 | E135: 10 | F135: 0 | G135: 0 | H135: 7
A136: =R[-1]C+1 -> 135 | B136: Carne, bovina, acém, sem gordura, cru | C136: 144 | D136: 20 | E136: 6 | F136: 0 | G136: 0 | H136: 4
A137: =R[-1]C+1 -> 136 | B137: Carne, bovina, almôndegas, cruas | C137: 189 | D137: 12 | E137: 11 | F137: 9 | G137: 0 | H137: 22
A138: =R[-1]C+1 -> 137 | B138: Carne, bovina, almôndegas, fritas | C138: 271 | D138: 18 | E138: 15 | F138: 14 | G138: 0 | H138: 26
A139: =R[-1]C+1 -> 138 | B139: Carne, bovina, bucho, cozido | C139: 133 | D139: 21 | E139: 4 | F139: 0 | G139: 0 | H139: 13
A140: =R[-1]C+1 -> 139 | B140: Carne, bovina, bucho, cru | C140: 137 | D140: 20 | E140: 5 | F140: 0 | G140: 0 | H140: 9
A141: =R[-1]C+1 -> 140 | B141: Carne, bovina, capa de contra-filé, com gordura, crua | C141: 216 | D141: 19 | E141: 14 | F141: 0 | G141: 0 | H141: 5
A142: =R[-1]C+1 -> 141 | B142: Carne, bovina, capa de contra-filé, com gordura, grelhada | C142: 311 | D142: 30 | E142: 20 | F142: 0 | G142: 0 | H142: 7
A143: =R[-1]C+1 -> 142 | B143: Carne, bovina, capa de contra-filé, sem gordura, crua | C143: 131 | D143: 21 | E143: 4 | F143: 0 | G143: 0 | H143: 6
A144: =R[-1]C+1 -> 143 | B144: Carne, bovina, capa de contra-filé, sem gordura, grelhada | C144: 239 | D144: 35 | E144: 9 | F144: 0 | G144: 0 | H144: 8
A145: =R[-1]C+1 -> 144 | B145: Carne, bovina, charque, cozido | C145: 262 | D145: 36 | E145: 11 | F145: 0 | G145: 0 | H145: 14
A146: =R[-1]C+1 -> 145 | B146: Carne, bovina, charque, cru | C146: 248 | D146: 22 | E146: 16 | F146: 0 | G146: 0 | H146: 15
A147: =R[-1]C+1 -> 146 | B147: Carne, bovina, contra-filé de costela, cru | C147: 202 | D147: 19 | E147: 13 | F147: 0 | G147: 0 | H147: 3
A148: =R[-1]C+1 -> 147 | B148: Carne, bovina, contra-filé de costela, grelhado | C148: 274 | D148: 29 | E148: 16 | F148: 0 | G148: 0 | H148: 4
A149: =R[-1]C+1 -> 148 | B149: Carne, bovina, contra-filé, à milanesa | C149: 351 | D149: 20 | E149: 23 | F149: 12 | G149: 0 | H149: 14
A150: =R[-1]C+1 -> 149 | B150: Carne, bovina, contra-filé, com gordura, cru | C150: 205 | D150: 21 | E150: 12 | F150: 0 | G150: 0 | H150: 3
A151: =R[-1]C+1 -> 150 | B151: Carne, bovina, contra-filé, com gordura, grelhado | C151: 278 | D151: 32 | E151: 15 | F151: 0 | G151: 0 | H151: 4
A152: =R[-1]C+1 -> 151 | B152: Carne, bovina, contra-filé, sem gordura, cru | C152: 156 | D152: 23 | E152: 6 | F152: 0 | G152: 0 | H152: 4
A153: =R[-1]C+1 -> 152 | B153: Carne, bovina, contra-filé, sem gordura, grelhado | C153: 193 | D153: 35 | E153: 4 | F153: 0 | G153: 0 | H153: 4
A154: =R[-1]C+1 -> 153 | B154: Carne, bovina, costela, assada | C154: 373 | D154: 28 | E154: 27 | F154: 0 | G154: 0 | H154: 28
A155: =R[-1]C+1 -> 154 | B155: Carne, bovina, costela, crua | C155: 357 | D155: 16 | E155: 31 | F155: 0 | G155: 0 | H155: 0
A156: =R[-1]C+1 -> 155 | B156: Carne, bovina, coxão duro, sem gordura, cozido | C156: 216 | D156: 31 | E156: 8 | F156: 0 | G156: 0 | H156: 3
A157: =R[-1]C+1 -> 156 | B157: Carne, bovina, coxão duro, sem gordura, cru | C157: 147 | D157: 21 | E157: 6 | F157: 0 | G157: 0 | H157: 2
A158: =R[-1]C+1 -> 157 | B158: Carne, bovina, coxão mole, sem gordura, cozido | C158: 218 | D158: 32 | E158: 8 | F158: 0 | G158: 0 | H158: 3
A159: =R[-1]C+1 -> 158 | B159: Carne, bovina, coxão mole, sem gordura, cru | C159: 169 | D159: 21 | E159: 8 | F159: 0 | G159: 0 | H159: 2
A160: =R[-1]C+1 -> 159 | B160: Carne, bovina, cupim, assado | C160: 330 | D160: 28 | E160: 23 | F160: 0 | G160: 0 | H160: 7
A161: =R[-1]C+1 -> 160 | B161: Carne, bovina, cupim, cru | C161: 221 | D161: 19 | E161: 15 | F161: 0 | G161: 0 | H161: 3
A162: =R[-1]C+1 -> 161 | B162: Carne, bovina, fígado, cru | C162: 141 | D162: 20 | E162: 5 | F162: 1 | G162: 0 | H162: 4
A163: =R[-1]C+1 -> 162 | B163: Carne, bovina, fígado, grelhado | C163: 225 | D163: 29 | E163: 9 | F163: 4 | G163: 0 | H163: 5
A164: =R[-1]C+1 -> 163 | B164: Carne, bovina, filé mingnon, sem gordura, cru | C164: 142 | D164: 21 | E164: 5 | F164: 0 | G164: 0 | H164: 2
A165: =R[-1]C+1 -> 164 | B165: Carne, bovina, filé mingnon, sem gordura, grelhado | C165: 219 | D165: 32 | E165: 8 | F165: 0 | G165: 0 | H165: 4
A166: =R[-1]C+1 -> 165 | B166: Carne, bovina, flanco, sem gordura, cozido | C166: 195 | D166: 29 | E166: 7 | F166: 0 | G166: 0 | H166: 3
A167: =R[-1]C+1 -> 166 | B167: Carne, bovina, flanco, sem gordura, cru | C167: 141 | D167: 19 | E167: 6 | F167: 0 | G167: 0 | H167: 2
A168: =R[-1]C+1 -> 167 | B168: Carne, bovina, fraldinha, com gordura, cozida | C168: 338 | D168: 24 | E168: 26 | F168: 0 | G168: 0 | H168: 3
A169: =R[-1]C+1 -> 168 | B169: Carne, bovina, fraldinha, com gordura, crua | C169: 220 | D169: 17 | E169: 16 | F169: 0 | G169: 0 | H169: 3
A170: =R[-1]C+1 -> 169 | B170: Carne, bovina, lagarto, cozido | C170: 222 | D170: 32 | E170: 9 | F170: 0 | G170: 0 | H170: 3
A171: =R[-1]C+1 -> 170 | B171: Carne, bovina, lagarto, cru | C171: 134 | D171: 20 | E171: 5 | F171: 0 | G171: 0 | H171: 2
A172: =R[-1]C+1 -> 171 | B172: Carne, bovina, língua, cozida | C172: 314 | D172: 21 | E172: 24 | F172: 0 | G172: 0 | H172: 5
A173: =R[-1]C+1 -> 172 | B173: Carne, bovina, língua, crua | C173: 215 | D173: 17 | E173: 15 | F173: 0 | G173: 0 | H173: 5
A174: =R[-1]C+1 -> 173 | B174: Carne, bovina, maminha, crua | C174: 152 | D174: 20 | E174: 7 | F174: 0 | G174: 0 | H174: 2
A175: =R[-1]C+1 -> 174 | B175: Carne, bovina, maminha, grelhada | C175: 153 | D175: 30 | E175: 2 | F175: 0 | G175: 0 | H175: 4
A176: =R[-1]C+1 -> 175 | B176: Carne, bovina, miolo de alcatra, sem gordura, cru | C176: 162 | D176: 21 | E176: 7 | F176: 0 | G176: 0 | H176: 3
A177: =R[-1]C+1 -> 176 | B177: Carne, bovina, miolo de alcatra, sem gordura, grelhado | C177: 241 | D177: 31 | E177: 11 | F177: 0 | G177: 0 | H177: 4
A178: =R[-1]C+1 -> 177 | B178: Carne, bovina, músculo, sem gordura, cozido | C178: 193 | D178: 31 | E178: 6 | F178: 0 | G178: 0 | H178: 4
A179: =R[-1]C+1 -> 178 | B179: Carne, bovina, músculo, sem gordura, cru | C179: 141 | D179: 21 | E179: 5 | F179: 0 | G179: 0 | H179: 3
A180: =R[-1]C+1 -> 179 | B180: Carne, bovina, paleta, com gordura, crua | C180: 158 | D180: 21 | E180: 7 | F180: 0 | G180: 0 | H180: 4
A181: =R[-1]C+1 -> 180 | B181: Carne, bovina, paleta, sem gordura, cozida | C181: 193 | D181: 29 | E181: 7 | F181: 0 | G181: 0 | H181: 5
A182: =R[-1]C+1 -> 181 | B182: Carne, bovina, paleta, sem gordura, crua | C182: 140 | D182: 21 | E182: 5 | F182: 0 | G182: 0 | H182: 3
A183: =R[-1]C+1 -> 182 | B183: Carne, bovina, patinho, sem gordura, cru | C183: 133 | D183: 21 | E183: 4 | F183: 0 | G183: 0 | H183: 3
A184: =R[-1]C+1 -> 183 | B184: Carne, bovina, patinho, sem gordura, grelhado | C184: 219 | D184: 35 | E184: 7 | F184: 0 | G184: 0 | H184: 4
A185: =R[-1]C+1 -> 184 | B185: Carne, bovina, peito, sem gordura, cozido | C185: 338 | D185: 22 | E185: 26 | F185: 0 | G185: 0 | H185: 4
A186: =R[-1]C+1 -> 185 | B186: Carne, bovina, peito, sem gordura, cru | C186: 259 | D186: 17 | E186: 20 | F186: 0 | G186: 0 | H186: 3
A187: =R[-1]C+1 -> 186 | B187: Carne, bovina, picanha, com gordura, crua | C187: 212 | D187: 18 | E187: 14 | F187: 0 | G187: 0 | H187: 2
A188: =R[-1]C+1 -> 187 | B188: Carne, bovina, picanha, com gordura, grelhada | C188: 288 | D188: 26 | E188: 19 | F188: 0 | G188: 0 | H188: 4
A189: =R[-1]C+1 -> 188 | B189: Carne, bovina, picanha, sem gordura, crua | C189: 133 | D189: 21 | E189: 4 | F189: 0 | G189: 0 | H189: 3
A190: =R[-1]C+1 -> 189 | B190: Carne, bovina, picanha, sem gordura, grelhada | C190: 238 | D190: 31 | E190: 11 | F190: 0 | G190: 0 | H190: 4
A191: =R[-1]C+1 -> 190 | B191: Carne, bovina, seca, cozida | C191: 312 | D191: 26 | E191: 21 | F191: 0 | G191: 0 | H191: 12
A192: =R[-1]C+1 -> 191 | B192: Carne, bovina, seca, crua | C192: 312 | D192: 19 | E192: 25 | F192: 0 | G192: 0 | H192: 14
A193: =R[-1]C+1 -> 192 | B193: Caruru, cru | C193: 34 | D193: 3 | E193: 0 | F193: 5 | G193: 4 | H193: 455
A194: =R[-1]C+1 -> 193 | B194: Castanha-de-caju, torrada, salgada | C194: 570 | D194: 18 | E194: 46 | F194: 29 | G194: 3 | H194: 32
A195: =R[-1]C+1 -> 194 | B195: Castanha-do-Brasil, crua | C195: 642 | D195: 14 | E195: 63 | F195: 15 | G195: 7 | H195: 146
A196: =R[-1]C+1 -> 195 | B196: Catalonha, crua | C196: 23 | D196: 1 | E196: 0 | F196: 4 | G196: 2 | H196: 56
A197: =R[-1]C+1 -> 196 | B197: Catalonha, refogada | C197: 63 | D197: 1 | E197: 4 | F197: 4 | G197: 3 | H197: 63
A198: =R[-1]C+1 -> 197 | B198: Cebola, crua | C198: 39 | D198: 1 | E198: 0 | F198: 8 | G198: 2 | H198: 14
A199: =R[-1]C+1 -> 198 | B199: Cebolinha, crua | C199: 19 | D199: 1 | E199: 0 | F199: 3 | G199: 3 | H199: 79
A200: =R[-1]C+1 -> 199 | B200: Cenoura, cozida | C200: 29 | D200: 0 | E200: 0 | F200: 6 | G200: 2 | H200: 25
A201: =R[-1]C+1 -> 200 | B201: Cenoura, crua | C201: 34 | D201: 1 | E201: 0 | F201: 7 | G201: 3 | H201: 22
A202: =R[-1]C+1 -> 201 | B202: Cereais, milho, flocos, com sal | C202: 369 | D202: 7 | E202: 1 | F202: 80 | G202: 5 | H202: 1
A203: =R[-1]C+1 -> 202 | B203: Cereais, milho, flocos, sem sal | C203: 363 | D203: 6 | E203: 1 | F203: 80 | G203: 1 | H203: 1
A204: =R[-1]C+1 -> 203 | B204: Cereais, mingau, milho, infantil | C204: 394 | D204: 6 | E204: 1 | F204: 87 | G204: 3 | H204: 218
A205: =R[-1]C+1 -> 204 | B205: Cereais, mistura para vitamina, trigo, cevada e aveia | C205: 381 | D205: 8 | E205: 2 | F205: 81 | G205: 4 | H205: 584
A206: =R[-1]C+1 -> 205 | B206: Cereal matinal, milho | C206: 365 | D206: 7 | E206: 0 | F206: 83 | G206: 4 | H206: 142
A207: =R[-1]C+1 -> 206 | B207: Cereal matinal, milho, açúcar | C207: 376 | D207: 4 | E207: 0 | F207: 88 | G207: 2 | H207: 56
A208: =R[-1]C+1 -> 207 | B208: Cerveja, pilsen 2 | C208: 40 | D208: 0 | E208: 0 | F208: 3 | G208: 0 | H208: 4
A209: =R[-1]C+1 -> 208 | B209: Chá, erva-doce, infusão 5% | C209: 1 | D209: 0 | E209: 0 | F209: 0 | G209: 0 | H209: 1
A210: =R[-1]C+1 -> 209 | B210: Chá, mate, infusão 5% | C210: 2 | D210: 0 | E210: 0 | F210: 0 | G210: 0 | H210: 0
A211: =R[-1]C+1 -> 210 | B211: Chá, preto, infusão 5% | C211: 2 | D211: 0 | E211: 0 | F211: 0 | G211: 0 | H211: 0
A212: =R[-1]C+1 -> 211 | B212: Chantilly, spray, com gordura vegetal | C212: 314 | D212: 0 | E212: 27 | F212: 16 | G212: 0 | H212: 2
A213: =R[-1]C+1 -> 212 | B213: Charuto, de repolho | C213: 78 | D213: 6 | E213: 1 | F213: 10 | G213: 1 | H213: 22
A214: =R[-1]C+1 -> 213 | B214: Chicória, crua | C214: 13 | D214: 1 | E214: 0 | F214: 2 | G214: 2 | H214: 44
A215: =R[-1]C+1 -> 214 | B215: Chocolate, ao leite | C215: 539 | D215: 7 | E215: 30 | F215: 59 | G215: 2 | H215: 191
A216: =R[-1]C+1 -> 215 | B216: Chocolate, ao leite, com castanha do Pará | C216: 558 | D216: 7 | E216: 34 | F216: 55 | G216: 2 | H216: 171
A217: =R[-1]C+1 -> 216 | B217: Chocolate, ao leite, dietético | C217: 556 | D217: 6 | E217: 33 | F217: 56 | G217: 2 | H217: 187
A218: =R[-1]C+1 -> 217 | B218: Chocolate, meio amargo | C218: 474 | D218: 4 | E218: 29 | F218: 62 | G218: 4 | H218: 44
A219: =R[-1]C+1 -> 218 | B219: Chuchu, cozido | C219: 18 | D219: 0 | E219: 0 | F219: 4 | G219: 1 | H219: 7
A220: =R[-1]C+1 -> 219 | B220: Chuchu, cru | C220: 16 | D220: 0 | E220: 0 | F220: 4 | G220: 1 | H220: 11
A221: =R[-1]C+1 -> 220 | B221: Ciriguela, crua | C221: 75 | D221: 1 | E221: 0 | F221: 18 | G221: 3 | H221: 27
A222: =R[-1]C+1 -> 221 | B222: Cocada branca | C222: 448 | D222: 1 | E222: 13 | F222: 81 | G222: 3 | H222: 7
A223: =R[-1]C+1 -> 222 | B223: Coco, verde, cru | C223: 0 | D223: 0 | E223: 0 | F223: 0 | G223: 0 | H223: 0
A224: =R[-1]C+1 -> 223 | B224: Coco, água de | C224: 21 | D224: 0 | E224: 0 | F224: 5 | G224: 0 | H224: 18
A225: =R[-1]C+1 -> 224 | B225: Coco, cru | C225: 406 | D225: 3 | E225: 41 | F225: 10 | G225: 5 | H225: 6
A226: =R[-1]C+1 -> 225 | B226: Coentro, folhas desidratadas | C226: 309 | D226: 20 | E226: 10 | F226: 47 | G226: 37 | H226: 783
A227: =R[-1]C+1 -> 226 | B227: Corimba, cru | C227: 128 | D227: 17 | E227: 5 | F227: 0 | G227: 0 | H227: 40
A228: =R[-1]C+1 -> 227 | B228: Corimbatá, assado | C228: 261 | D228: 19 | E228: 19 | F228: 0 | G228: 0 | H228: 22
A229: =R[-1]C+1 -> 228 | B229: Corimbatá, cozido | C229: 238 | D229: 20 | E229: 16 | F229: 0 | G229: 0 | H229: 64
A230: =R[-1]C+1 -> 229 | B230: Corvina de água doce, crua | C230: 101 | D230: 18 | E230: 2 | F230: 0 | G230: 0 | H230: 39
A231: =R[-1]C+1 -> 230 | B231: Corvina do mar, crua | C231: 94 | D231: 18 | E231: 1 | F231: 0 | G231: 0 | H231: 0
A232: =R[-1]C+1 -> 231 | B232: Corvina grande, assada | C232: 146 | D232: 26 | E232: 3 | F232: 0 | G232: 0 | H232: 60
A233: =R[-1]C+1 -> 232 | B233: Corvina grande, cozida | C233: 100 | D233: 23 | E233: 2 | F233: 0 | G233: 0 | H233: 69
A234: =R[-1]C+1 -> 233 | B234: Couve, manteiga, crua | C234: 27 | D234: 2 | E234: 0 | F234: 4 | G234: 3 | H234: 130
A235: =R[-1]C+1 -> 234 | B235: Couve, manteiga, refogada | C235: 90 | D235: 1 | E235: 6 | F235: 8 | G235: 5 | H235: 177
A236: =R[-1]C+1 -> 235 | B236: Couve-flor, cozida | C236: 19 | D236: 1 | E236: 0 | F236: 3 | G236: 2 | H236: 16
A237: =R[-1]C+1 -> 236 | B237: Couve-flor, crua | C237: 22 | D237: 1 | E237: 0 | F237: 4 | G237: 2 | H237: 17
A238: =R[-1]C+1 -> 237 | B238: Coxinha de frango, frita | C238: 283 | D238: 9 | E238: 11 | F238: 34 | G238: 4 | H238: 18
A239: =R[-1]C+1 -> 238 | B239: Creme de arroz, pó | C239: 386 | D239: 7 | E239: 1 | F239: 83 | G239: 1 | H239: 7
A240: =R[-1]C+1 -> 239 | B240: Creme de Leite | C240: 221 | D240: 1 | E240: 22 | F240: 4 | G240: 0 | H240: 82
A241: =R[-1]C+1 -> 240 | B241: Creme de milho, pó | C241: 333 | D241: 4 | E241: 1 | F241: 86 | G241: 3 | H241: 323
A242: =R[-1]C+1 -> 241 | B242: Croquete, de carne, cru | C242: 245 | D242: 12 | E242: 15 | F242: 13 | G242: 0 | H242: 15
A243: =R[-1]C+1 -> 242 | B243: Croquete, de carne, frito | C243: 346 | D243: 16 | E243: 22 | F243: 18 | G243: 0 | H243: 18
A244: =R[-1]C+1 -> 243 | B244: Cupuaçu, cru | C244: 49 | D244: 1 | E244: 0 | F244: 10 | G244: 3 | H244: 13
A245: =R[-1]C+1 -> 244 | B245: Cupuaçu, polpa, congelada | C245: 48 | D245: 0 | E245: 0 | F245: 11 | G245: 1 | H245: 5
A246: =R[-1]C+1 -> 245 | B246: Curau, milho verde | C246: 78 | D246: 2 | E246: 1 | F246: 13 | G246: 0 | H246: 52
A247: =R[-1]C+1 -> 246 | B247: Curau, milho verde, mistura para | C247: 402 | D247: 2 | E247: 13 | F247: 79 | G247: 2 | H247: 30
A248: =R[-1]C+1 -> 247 | B248: Cuscuz, de milho, cozido com sal | C248: 113 | D248: 2 | E248: 0 | F248: 25 | G248: 2 | H248: 1
A249: =R[-1]C+1 -> 248 | B249: Cuscuz, paulista | C249: 142 | D249: 2 | E249: 4 | F249: 22 | G249: 2 | H249: 14
A250: =R[-1]C+1 -> 249 | B250: Cuxá, molho | C250: 80 | D250: 5 | E250: 3 | F250: 5 | G250: 3 | H250: 105
A251: =R[-1]C+1 -> 250 | B251: Dobradinha | C251: 124 | D251: 19 | E251: 4 | F251: 0 | G251: 0 | H251: 11
A252: =R[-1]C+1 -> 251 | B252: Doce, de abóbora, cremoso | C252: 198 | D252: 0 | E252: 0 | F252: 54 | G252: 2 | H252: 12
A253: =R[-1]C+1 -> 252 | B253: Doce, de leite, cremoso | C253: 306 | D253: 5 | E253: 5 | F253: 59 | G253: 0 | H253: 195
A254: =R[-1]C+1 -> 253 | B254: Dourada de água doce, fresca | C254: 131 | D254: 18 | E254: 5 | F254: 0 | G254: 0 | H254: 12
A255: =R[-1]C+1 -> 254 | B255: Empada de frango, pré-cozida, assada | C255: 358 | D255: 6 | E255: 15 | F255: 47 | G255: 2 | H255: 15
A256: =R[-1]C+1 -> 255 | B256: Empada, de frango, pré-cozida | C256: 377 | D256: 7 | E256: 22 | F256: 35 | G256: 2 | H256: 13
A257: =R[-1]C+1 -> 256 | B257: Ervilha, em vagem | C257: 88 | D257: 7 | E257: 0 | F257: 14 | G257: 9 | H257: 24
A258: =R[-1]C+1 -> 257 | B258: Ervilha, enlatada, drenada | C258: 73 | D258: 4 | E258: 0 | F258: 13 | G258: 5 | H258: 22
A259: =R[-1]C+1 -> 258 | B259: Espinafre, Nova Zelândia, cru | C259: 16 | D259: 1 | E259: 0 | F259: 2 | G259: 2 | H259: 97
A260: =R[-1]C+1 -> 259 | B260: Espinafre, Nova Zelândia, refogado | C260: 67 | D260: 2 | E260: 5 | F260: 4 | G260: 2 | H260: 112
A261: =R[-1]C+1 -> 260 | B261: Estrogonofe de carne | C261: 173 | D261: 15 | E261: 10 | F261: 2 | G261: 0 | H261: 28
A262: =R[-1]C+1 -> 261 | B262: Estrogonofe de frango | C262: 156 | D262: 17 | E262: 7 | F262: 2 | G262: 0 | H262: 26
A263: =R[-1]C+1 -> 262 | B263: Farinha, de arroz, enriquecida | C263: 363 | D263: 1 | E263: 0 | F263: 85 | G263: 0 | H263: 1
A264: =R[-1]C+1 -> 263 | B264: Farinha, de centeio, integral | C264: 335 | D264: 12 | E264: 1 | F264: 73 | G264: 15 | H264: 33
A265: =R[-1]C+1 -> 264 | B265: Farinha, de mandioca, crua | C265: 360 | D265: 1 | E265: 0 | F265: 87 | G265: 6 | H265: 64
A266: =R[-1]C+1 -> 265 | B266: Farinha, de mandioca, torrada | C266: 365 | D266: 1 | E266: 0 | F266: 89 | G266: 6 | H266: 75
A267: =R[-1]C+1 -> 266 | B267: Farinha, de mesocarpo de babaçu, crua | C267: 328 | D267: 1 | E267: 0 | F267: 79 | G267: 17 | H267: 60
A268: =R[-1]C+1 -> 267 | B268: Farinha, de milho, amarela | C268: 350 | D268: 7 | E268: 1 | F268: 79 | G268: 5 | H268: 1
A269: =R[-1]C+1 -> 268 | B269: Farinha, de puba | C269: 360 | D269: 1 | E269: 0 | F269: 87 | G269: 4 | H269: 41
A270: =R[-1]C+1 -> 269 | B270: Farinha, de rosca | C270: 370 | D270: 11 | E270: 1 | F270: 75 | G270: 4 | H270: 35
A271: =R[-1]C+1 -> 270 | B271: Farinha, de trigo | C271: 360 | D271: 9 | E271: 1 | F271: 75 | G271: 2 | H271: 17
A272: =R[-1]C+1 -> 271 | B272: Farinha, láctea, de cereais | C272: 414 | D272: 11 | E272: 5 | F272: 77 | G272: 1 | H272: 196
A273: =R[-1]C+1 -> 272 | B273: Fécula, de mandioca | C273: 330 | D273: 0 | E273: 0 | F273: 81 | G273: 0 | H273: 11
A274: =R[-1]C+1 -> 273 | B274: Feijão tropeiro mineiro | C274: 151 | D274: 10 | E274: 6 | F274: 19 | G274: 3 | H274: 41
A275: =R[-1]C+1 -> 274 | B275: Feijão, broto, cru | C275: 38 | D275: 4 | E275: 0 | F275: 7 | G275: 1 | H275: 14
A276: =R[-1]C+1 -> 275 | B276: Feijão, carioca, cozido | C276: 76 | D276: 4 | E276: 0 | F276: 13 | G276: 8 | H276: 26
A277: =R[-1]C+1 -> 276 | B277: Feijão, carioca, cru | C277: 329 | D277: 19 | E277: 1 | F277: 61 | G277: 18 | H277: 122
A278: =R[-1]C+1 -> 277 | B278: Feijão, fradinho, cozido | C278: 78 | D278: 5 | E278: 0 | F278: 13 | G278: 7 | H278: 17
A279: =R[-1]C+1 -> 278 | B279: Feijão, fradinho, cru | C279: 339 | D279: 20 | E279: 2 | F279: 61 | G279: 23 | H279: 77
A280: =R[-1]C+1 -> 279 | B280: Feijão, jalo, cozido | C280: 92 | D280: 6 | E280: 0 | F280: 16 | G280: 13 | H280: 29
A281: =R[-1]C+1 -> 280 | B281: Feijão, jalo, cru | C281: 327 | D281: 20 | E281: 0 | F281: 61 | G281: 30 | H281: 97
A282: =R[-1]C+1 -> 281 | B282: Feijão, preto, cozido | C282: 77 | D282: 4 | E282: 0 | F282: 14 | G282: 8 | H282: 29
A283: =R[-1]C+1 -> 282 | B283: Feijão, preto, cru | C283: 323 | D283: 21 | E283: 1 | F283: 58 | G283: 21 | H283: 110
A284: =R[-1]C+1 -> 283 | B284: Feijão, rajado, cozido | C284: 84 | D284: 5 | E284: 0 | F284: 15 | G284: 9 | H284: 29
A285: =R[-1]C+1 -> 284 | B285: Feijão, rajado, cru | C285: 325 | D285: 17 | E285: 1 | F285: 62 | G285: 24 | H285: 111
A286: =R[-1]C+1 -> 285 | B286: Feijão, rosinha, cozido | C286: 67 | D286: 4 | E286: 0 | F286: 11 | G286: 4 | H286: 19
A287: =R[-1]C+1 -> 286 | B287: Feijão, rosinha, cru | C287: 336 | D287: 20 | E287: 1 | F287: 62 | G287: 20 | H287: 67
A288: =R[-1]C+1 -> 287 | B288: Feijão, roxo, cozido | C288: 76 | D288: 5 | E288: 0 | F288: 12 | G288: 11 | H288: 22
A289: =R[-1]C+1 -> 288 | B289: Feijão, roxo, cru | C289: 331 | D289: 22 | E289: 1 | F289: 59 | G289: 33 | H289: 120
A290: =R[-1]C+1 -> 289 | B290: Fermento em pó, químico | C290: 89 | D290: 0 | E290: 0 | F290: 43 | G290: 0 | H290: 0
A291: =R[-1]C+1 -> 290 | B291: Fermento, biológico, levedura, tablete | C291: 89 | D291: 16 | E291: 1 | F291: 7 | G291: 4 | H291: 18
A292: =R[-1]C+1 -> 291 | B292: Figo, cru | C292: 41 | D292: 0 | E292: 0 | F292: 10 | G292: 1 | H292: 27
A293: =R[-1]C+1 -> 292 | B293: Figo, enlatado, em calda | C293: 184 | D293: 0 | E293: 0 | F293: 50 | G293: 1 | H293: 32
A294: =R[-1]C+1 -> 293 | B294: Frango, asa, com pele, crua | C294: 213 | D294: 18 | E294: 15 | F294: 0 | G294: 0 | H294: 10
A295: =R[-1]C+1 -> 294 | B295: Frango, caipira, inteiro, com pele, cozido | C295: 242 | D295: 23 | E295: 15 | F295: 0 | G295: 0 | H295: 16
A296: =R[-1]C+1 -> 295 | B296: Frango, caipira, inteiro, sem pele, cozido | C296: 195 | D296: 29 | E296: 7 | F296: 0 | G296: 0 | H296: 66
A297: =R[-1]C+1 -> 296 | B297: Frango, com açafrão | C297: 112 | D297: 9 | E297: 6 | F297: 4 | G297: 0 | H297: 12
A298: =R[-1]C+1 -> 297 | B298: Frango, coração, cru | C298: 221 | D298: 12 | E298: 18 | F298: 0 | G298: 0 | H298: 5
A299: =R[-1]C+1 -> 298 | B299: Frango, coração, grelhado | C299: 207 | D299: 22 | E299: 12 | F299: 0 | G299: 0 | H299: 8
A300: =R[-1]C+1 -> 299 | B300: Frango, coxa, com pele, assada | C300: 215 | D300: 28 | E300: 10 | F300: 0 | G300: 0 | H300: 8
A301: =R[-1]C+1 -> 300 | B301: Frango, coxa, com pele, crua | C301: 161 | D301: 17 | E301: 9 | F301: 0 | G301: 0 | H301: 8
A302: =R[-1]C+1 -> 301 | B302: Frango, coxa, sem pele, cozida | C302: 167 | D302: 26 | E302: 5 | F302: 0 | G302: 0 | H302: 11
A303: =R[-1]C+1 -> 302 | B303: Frango, coxa, sem pele, crua | C303: 119 | D303: 17 | E303: 4 | F303: 0 | G303: 0 | H303: 7
A304: =R[-1]C+1 -> 303 | B304: Frango, fígado, cru | C304: 106 | D304: 17 | E304: 3 | F304: 0 | G304: 0 | H304: 5
A305: =R[-1]C+1 -> 304 | B305: Frango, filé, à milanesa | C305: 220 | D305: 28 | E305: 7 | F305: 7 | G305: 1 | H305: 8
A306: =R[-1]C+1 -> 305 | B306: Frango, inteiro, com pele, cru | C306: 226 | D306: 16 | E306: 17 | F306: 0 | G306: 0 | H306: 6
A307: =R[-1]C+1 -> 306 | B307: Frango, inteiro, sem pele, assado | C307: 187 | D307: 28 | E307: 7 | F307: 0 | G307: 0 | H307: 9
A308: =R[-1]C+1 -> 307 | B308: Frango, inteiro, sem pele, cozido | C308: 170 | D308: 24 | E308: 7 | F308: 0 | G308: 0 | H308: 8
A309: =R[-1]C+1 -> 308 | B309: Frango, inteiro, sem pele, cru | C309: 129 | D309: 20 | E309: 4 | F309: 0 | G309: 0 | H309: 6
A310: =R[-1]C+1 -> 309 | B310: Frango, peito, com pele, assado | C310: 211 | D310: 33 | E310: 7 | F310: 0 | G310: 0 | H310: 8
A311: =R[-1]C+1 -> 310 | B311: Frango, peito, com pele, cru | C311: 149 | D311: 20 | E311: 6 | F311: 0 | G311: 0 | H311: 8
A312: =R[-1]C+1 -> 311 | B312: Frango, peito, sem pele, cozido | C312: 162 | D312: 31 | E312: 3 | F312: 0 | G312: 0 | H312: 6
A313: =R[-1]C+1 -> 312 | B313: Frango, peito, sem pele, cru | C313: 119 | D313: 21 | E313: 3 | F313: 0 | G313: 0 | H313: 7
A314: =R[-1]C+1 -> 313 | B314: Frango, peito, sem pele, grelhado | C314: 159 | D314: 32 | E314: 2 | F314: 0 | G314: 0 | H314: 5
A315: =R[-1]C+1 -> 314 | B315: Frango, sobrecoxa, com pele, assada | C315: 259 | D315: 28 | E315: 15 | F315: 0 | G315: 0 | H315: 10
A316: =R[-1]C+1 -> 315 | B316: Frango, sobrecoxa, com pele, crua | C316: 254 | D316: 15 | E316: 20 | F316: 0 | G316: 0 | H316: 7
A317: =R[-1]C+1 -> 316 | B317: Frango, sobrecoxa, sem pele, assada | C317: 232 | D317: 29 | E317: 12 | F317: 0 | G317: 0 | H317: 12
A318: =R[-1]C+1 -> 317 | B318: Frango, sobrecoxa, sem pele, crua | C318: 161 | D318: 17 | E318: 9 | F318: 0 | G318: 0 | H318: 6
A319: =R[-1]C+1 -> 318 | B319: Fruta-pão, crua | C319: 67 | D319: 1 | E319: 0 | F319: 17 | G319: 5 | H319: 33
A320: =R[-1]C+1 -> 319 | B320: Gelatina, sabores variados, pó | C320: 380 | D320: 8 | E320: 0 | F320: 89 | G320: 0 | H320: 26
A321: =R[-1]C+1 -> 320 | B321: Geléia, mocotó, natural | C321: 106 | D321: 2 | E321: 0 | F321: 24 | G321: 0 | H321: 3
A322: =R[-1]C+1 -> 321 | B322: Gergelim, semente | C322: 583 | D322: 21 | E322: 50 | F322: 21 | G322: 11 | H322: 825
A323: =R[-1]C+1 -> 322 | B323: Glicose de milho | C323: 292 | D323: 0 | E323: 0 | F323: 79 | G323: 0 | H323: 5
A324: =R[-1]C+1 -> 323 | B324: Goiaba, branca, com casca, crua | C324: 51 | D324: 0 | E324: 0 | F324: 12 | G324: 6 | H324: 5
A325: =R[-1]C+1 -> 324 | B325: Goiaba, doce em pasta | C325: 268 | D325: 0 | E325: 0 | F325: 74 | G325: 3 | H325: 10
A326: =R[-1]C+1 -> 325 | B326: Goiaba, doce, cascão | C326: 285 | D326: 0 | E326: 0 | F326: 78 | G326: 4 | H326: 14
A327: =R[-1]C+1 -> 326 | B327: Goiaba, vermelha, com casca, crua | C327: 54 | D327: 1 | E327: 0 | F327: 13 | G327: 6 | H327: 4
A328: =R[-1]C+1 -> 327 | B328: Grão-de-bico, cru | C328: 354 | D328: 21 | E328: 5 | F328: 57 | G328: 12 | H328: 114
A329: =R[-1]C+1 -> 328 | B329: Graviola, crua | C329: 61 | D329: 0 | E329: 0 | F329: 15 | G329: 1 | H329: 40
A330: =R[-1]C+1 -> 329 | B330: Graviola, polpa, congelada | C330: 38 | D330: 0 | E330: 0 | F330: 9 | G330: 1 | H330: 5
A331: =R[-1]C+1 -> 330 | B331: Guandu, cru | C331: 344 | D331: 18 | E331: 2 | F331: 64 | G331: 21 | H331: 129
A332: =R[-1]C+1 -> 331 | B332: Hambúrguer, bovino, cru | C332: 214 | D332: 13 | E332: 16 | F332: 4 | G332: 0 | H332: 34
A333: =R[-1]C+1 -> 332 | B333: Hambúrguer, bovino, frito | C333: 258 | D333: 19 | E333: 17 | F333: 6 | G333: 0 | H333: 62
A334: =R[-1]C+1 -> 333 | B334: Hambúrguer, bovino, grelhado | C334: 209 | D334: 13 | E334: 12 | F334: 11 | G334: 0 | H334: 56
A335: =R[-1]C+1 -> 334 | B335: Inhame, cru | C335: 96 | D335: 2 | E335: 0 | F335: 23 | G335: 1 | H335: 11
A336: =R[-1]C+1 -> 335 | B336: Iogurte, natural | C336: 51 | D336: 4 | E336: 3 | F336: 1 | G336: 0 | H336: 143
A337: =R[-1]C+1 -> 336 | B337: Iogurte, natural, desnatado | C337: 41 | D337: 3 | E337: 0 | F337: 5 | G337: 0 | H337: 156
A338: =R[-1]C+1 -> 337 | B338: Iogurte, sabor abacaxi | C338: 0 | D338: 0 | E338: 0 | F338: 0 | G338: 0 | H338: 0
A339: =R[-1]C+1 -> 338 | B339: Iogurte, sabor morango | C339: 69 | D339: 2 | E339: 2 | F339: 9 | G339: 0 | H339: 101
A340: =R[-1]C+1 -> 339 | B340: Iogurte, sabor pêssego | C340: 67 | D340: 2 | E340: 2 | F340: 9 | G340: 0 | H340: 95
A341: =R[-1]C+1 -> 340 | B341: Jabuticaba, crua | C341: 58 | D341: 0 | E341: 0 | F341: 15 | G341: 2 | H341: 8
A342: =R[-1]C+1 -> 341 | B342: Jaca, crua | C342: 87 | D342: 1 | E342: 0 | F342: 22 | G342: 2 | H342: 11
A343: =R[-1]C+1 -> 342 | B343: Jambo, cru | C343: 26 | D343: 0 | E343: 0 | F343: 6 | G343: 5 | H343: 13
A344: =R[-1]C+1 -> 343 | B344: Jamelão, cru | C344: 41 | D344: 0 | E344: 0 | F344: 10 | G344: 1 | H344: 3
A345: =R[-1]C+1 -> 344 | B345: Jiló, cru | C345: 27 | D345: 1 | E345: 0 | F345: 6 | G345: 4 | H345: 19
A346: =R[-1]C+1 -> 345 | B346: Jurubeba, crua | C346: 125 | D346: 4 | E346: 3 | F346: 23 | G346: 23 | H346: 151
A347: =R[-1]C+1 -> 346 | B347: Kiwi, cru | C347: 51 | D347: 1 | E347: 0 | F347: 11 | G347: 2 | H347: 23
A348: =R[-1]C+1 -> 347 | B348: L | C348: 116 | D348: 8 | E348: 6 | F348: 11 | G348: 5 | H348: 32
A349: =R[-1]C+1 -> 348 | B349: Lambari, congelado, cru | C349: 130 | D349: 16 | E349: 6 | F349: 0 | G349: 0 | H349: 1181
A350: =R[-1]C+1 -> 349 | B350: Lambari, congelado, frito | C350: 326 | D350: 28 | E350: 22 | F350: 0 | G350: 0 | H350: 1881
A351: =R[-1]C+1 -> 350 | B351: Lambari, fresco, cru | C351: 151 | D351: 15 | E351: 9 | F351: 0 | G351: 0 | H351: 590
A352: =R[-1]C+1 -> 351 | B352: Laranja, baía, crua | C352: 45 | D352: 0 | E352: 0 | F352: 11 | G352: 1 | H352: 35
A353: =R[-1]C+1 -> 352 | B353: Laranja, baía, suco | C353: 36 | D353: 0 | E353: 0 | F353: 8 | G353: 0 | H353: 5
A354: =R[-1]C+1 -> 353 | B354: Laranja, da terra, crua | C354: 51 | D354: 1 | E354: 0 | F354: 12 | G354: 3 | H354: 51
A355: =R[-1]C+1 -> 354 | B355: Laranja, da terra, suco | C355: 40 | D355: 0 | E355: 0 | F355: 9 | G355: 1 | H355: 13
A356: =R[-1]C+1 -> 355 | B356: Laranja, lima, crua | C356: 45 | D356: 1 | E356: 0 | F356: 11 | G356: 1 | H356: 31
A357: =R[-1]C+1 -> 356 | B357: Laranja, lima, suco | C357: 39 | D357: 0 | E357: 0 | F357: 9 | G357: 0 | H357: 7
A358: =R[-1]C+1 -> 357 | B358: Laranja, pêra, crua | C358: 36 | D358: 1 | E358: 0 | F358: 8 | G358: 0 | H358: 21
A359: =R[-1]C+1 -> 358 | B359: Laranja, pêra, suco | C359: 32 | D359: 0 | E359: 0 | F359: 7 | G359: 0 | H359: 7
A360: =R[-1]C+1 -> 359 | B360: Laranja, valência, crua | C360: 46 | D360: 0 | E360: 0 | F360: 11 | G360: 1 | H360: 33
A361: =R[-1]C+1 -> 360 | B361: Laranja, valência, suco | C361: 36 | D361: 0 | E361: 0 | F361: 8 | G361: 0 | H361: 9
A362: =R[-1]C+1 -> 361 | B362: Lasanha, massa fresca, cozida | C362: 163 | D362: 5 | E362: 1 | F362: 32 | G362: 1 | H362: 9
A363: =R[-1]C+1 -> 362 | B363: Lasanha, massa fresca, crua | C363: 220 | D363: 7 | E363: 1 | F363: 45 | G363: 1 | H363: 16
A364: =R[-1]C+1 -> 363 | B364: Leite, condensado | C364: 312 | D364: 7 | E364: 6 | F364: 56 | G364: 0 | H364: 246
A365: =R[-1]C+1 -> 364 | B365: Leite, de cabra | C365: 66 | D365: 3 | E365: 3 | F365: 5 | G365: 0 | H365: 112
A366: =R[-1]C+1 -> 365 | B366: Leite, de coco | C366: 166 | D366: 1 | E366: 18 | F366: 2 | G366: 0 | H366: 5
A367: =R[-1]C+1 -> 366 | B367: Leite, de vaca, achocolatado | C367: 82 | D367: 2 | E367: 2 | F367: 14 | G367: 0 | H367: 69
A368: =R[-1]C+1 -> 367 | B368: Leite, de vaca, desnatado, pó | C368: 361 | D368: 34 | E368: 0 | F368: 53 | G368: 0 | H368: 1363
A369: =R[-1]C+1 -> 368 | B369: Leite, de vaca, desnatado, UHT | C369: 0 | D369: 0 | E369: 0 | F369: 0 | G369: 0 | H369: 133
A370: =R[-1]C+1 -> 369 | B370: Leite, de vaca, integral | C370: 0 | D370: 0 | E370: 0 | F370: 0 | G370: 0 | H370: 122
A371: =R[-1]C+1 -> 370 | B371: Leite, de vaca, integral, pó | C371: 496 | D371: 25 | E371: 26 | F371: 39 | G371: 0 | H371: 890
A372: =R[-1]C+1 -> 371 | B372: Leite, fermentado | C372: 69 | D372: 1 | E372: 0 | F372: 15 | G372: 0 | H372: 71
A373: =R[-1]C+1 -> 372 | B373: Lentilha, cozida | C373: 92 | D373: 6 | E373: 0 | F373: 16 | G373: 7 | H373: 16
A374: =R[-1]C+1 -> 373 | B374: Lentilha, crua | C374: 339 | D374: 23 | E374: 0 | F374: 62 | G374: 16 | H374: 53
A375: =R[-1]C+1 -> 374 | B375: Limão, cravo, suco | C375: 14 | D375: 0 | E375: 0 | F375: 5 | G375: 0 | H375: 10
A376: =R[-1]C+1 -> 375 | B376: Limão, galego, suco | C376: 22 | D376: 0 | E376: 0 | F376: 7 | G376: 0 | H376: 5
A377: =R[-1]C+1 -> 376 | B377: Limão, tahiti, cru | C377: 31 | D377: 0 | E377: 0 | F377: 11 | G377: 1 | H377: 50
A378: =R[-1]C+1 -> 377 | B378: Lingüiça, frango, crua | C378: 218 | D378: 14 | E378: 17 | F378: 0 | G378: 0 | H378: 10
A379: =R[-1]C+1 -> 378 | B379: Lingüiça, frango, frita | C379: 245 | D379: 18 | E379: 18 | F379: 0 | G379: 0 | H379: 15
A380: =R[-1]C+1 -> 379 | B380: Lingüiça, frango, grelhada | C380: 243 | D380: 18 | E380: 18 | F380: 0 | G380: 0 | H380: 13
A381: =R[-1]C+1 -> 380 | B381: Lingüiça, porco, crua | C381: 227 | D381: 16 | E381: 17 | F381: 0 | G381: 0 | H381: 6
A382: =R[-1]C+1 -> 381 | B382: Lingüiça, porco, frita | C382: 279 | D382: 20 | E382: 21 | F382: 0 | G382: 0 | H382: 8
A383: =R[-1]C+1 -> 382 | B383: Lingüiça, porco, grelhada | C383: 296 | D383: 23 | E383: 21 | F383: 0 | G383: 0 | H383: 8
A384: =R[-1]C+1 -> 383 | B384: Linhaça, semente | C384: 495 | D384: 14 | E384: 32 | F384: 43 | G384: 33 | H384: 211
A385: =R[-1]C+1 -> 384 | B385: Maçã, Argentina, com casca, crua | C385: 62 | D385: 0 | E385: 0 | F385: 16 | G385: 2 | H385: 3
A386: =R[-1]C+1 -> 385 | B386: Maçã, Fuji, com casca, crua | C386: 55 | D386: 0 | E386: 0 | F386: 15 | G386: 1 | H386: 1
A387: =R[-1]C+1 -> 386 | B387: Macarrão, instantâneo | C387: 435 | D387: 8 | E387: 17 | F387: 62 | G387: 5 | H387: 17
A388: =R[-1]C+1 -> 387 | B388: Macarrão, molho bolognesa | C388: 119 | D388: 4 | E388: 0 | F388: 22 | G388: 0 | H388: 10
A389: =R[-1]C+1 -> 388 | B389: Macarrão, trigo, cru | C389: 371 | D389: 9 | E389: 1 | F389: 77 | G389: 2 | H389: 17
A390: =R[-1]C+1 -> 389 | B390: Macarrão, trigo, cru, com ovos | C390: 370 | D390: 10 | E390: 1 | F390: 76 | G390: 2 | H390: 19
A391: =R[-1]C+1 -> 390 | B391: Macaúba, crua | C391: 404 | D391: 2 | E391: 40 | F391: 13 | G391: 13 | H391: 66
A392: =R[-1]C+1 -> 391 | B392: Maionese, tradicional com ovos | C392: 302 | D392: 0 | E392: 30 | F392: 7 | G392: 0 | H392: 3
A393: =R[-1]C+1 -> 392 | B393: Mamão verde, doce em calda, drenado | C393: 209 | D393: 0 | E393: 0 | F393: 57 | G393: 1 | H393: 12
A394: =R[-1]C+1 -> 393 | B394: Mamão, doce em calda, drenado | C394: 195 | D394: 0 | E394: 0 | F394: 54 | G394: 1 | H394: 20
A395: =R[-1]C+1 -> 394 | B395: Mamão, Formosa, cru | C395: 45 | D395: 0 | E395: 0 | F395: 11 | G395: 1 | H395: 24
A396: =R[-1]C+1 -> 395 | B396: Mamão, Papaia, cru | C396: 40 | D396: 0 | E396: 0 | F396: 10 | G396: 1 | H396: 22
A397: =R[-1]C+1 -> 396 | B397: Mandioca, cozida | C397: 125 | D397: 0 | E397: 0 | F397: 30 | G397: 1 | H397: 18
A398: =R[-1]C+1 -> 397 | B398: Mandioca, crua | C398: 151 | D398: 1 | E398: 0 | F398: 36 | G398: 1 | H398: 15
A399: =R[-1]C+1 -> 398 | B399: Mandioca, farofa, temperada | C399: 405 | D399: 2 | E399: 9 | F399: 80 | G399: 7 | H399: 65
A400: =R[-1]C+1 -> 399 | B400: Mandioca, frita | C400: 300 | D400: 1 | E400: 11 | F400: 50 | G400: 1 | H400: 23
A401: =R[-1]C+1 -> 400 | B401: Manga, Haden, crua | C401: 63 | D401: 0 | E401: 0 | F401: 16 | G401: 1 | H401: 11
A402: =R[-1]C+1 -> 401 | B402: Manga, Palmer, crua | C402: 72 | D402: 0 | E402: 0 | F402: 19 | G402: 1 | H402: 11
A403: =R[-1]C+1 -> 402 | B403: Manga, polpa, congelada | C403: 48 | D403: 0 | E403: 0 | F403: 12 | G403: 1 | H403: 7
A404: =R[-1]C+1 -> 403 | B404: Manga, Tommy Atkins, crua | C404: 50 | D404: 0 | E404: 0 | F404: 12 | G404: 2 | H404: 7
A405: =R[-1]C+1 -> 404 | B405: Maniçoba | C405: 134 | D405: 9 | E405: 8 | F405: 3 | G405: 2 | H405: 65
A406: =R[-1]C+1 -> 405 | B406: Manjericão, cru | C406: 21 | D406: 1 | E406: 0 | F406: 3 | G406: 3 | H406: 210
A407: =R[-1]C+1 -> 406 | B407: Manjuba, com farinha de trigo, frita | C407: 343 | D407: 23 | E407: 22 | F407: 10 | G407: 0 | H407: 763
A408: =R[-1]C+1 -> 407 | B408: Manjuba, frita | C408: 349 | D408: 30 | E408: 24 | F408: 0 | G408: 0 | H408: 575
A409: =R[-1]C+1 -> 408 | B409: Manteiga, com sal | C409: 725 | D409: 0 | E409: 82 | F409: 0 | G409: 0 | H409: 9
A410: =R[-1]C+1 -> 409 | B410: Manteiga, sem sal | C410: 757 | D410: 0 | E410: 86 | F410: 0 | G410: 0 | H410: 3
A411: =R[-1]C+1 -> 410 | B411: Maracujá, cru | C411: 68 | D411: 1 | E411: 2 | F411: 12 | G411: 1 | H411: 5
A412: =R[-1]C+1 -> 411 | B412: Maracujá, polpa, congelada | C412: 38 | D412: 0 | E412: 0 | F412: 9 | G412: 0 | H412: 4
A413: =R[-1]C+1 -> 412 | B413: Maracujá, suco concentrado, envasado | C413: 41 | D413: 0 | E413: 0 | F413: 9 | G413: 0 | H413: 4
A414: =R[-1]C+1 -> 413 | B414: Margarina, com óleo hidrogenado, com sal (65% de lipídeos) | C414: 596 | D414: 0 | E414: 67 | F414: 0 | G414: 0 | H414: 5
A415: =R[-1]C+1 -> 414 | B415: Margarina, com óleo hidrogenado, sem sal (80% de lipídeos) | C415: 722 | D415: 0 | E415: 81 | F415: 0 | G415: 0 | H415: 2
A416: =R[-1]C+1 -> 415 | B416: Margarina, com óleo interesterificado, com sal (65%de lipídeos) | C416: 594 | D416: 0 | E416: 67 | F416: 0 | G416: 0 | H416: 4
A417: =R[-1]C+1 -> 416 | B417: Margarina, com óleo interesterificado, sem sal (65% de lipídeos) | C417: 593 | D417: 0 | E417: 67 | F417: 0 | G417: 0 | H417: 4
A418: =R[-1]C+1 -> 417 | B418: Maria mole | C418: 301 | D418: 3 | E418: 0 | F418: 73 | G418: 0 | H418: 13
A419: =R[-1]C+1 -> 418 | B419: Maria mole, coco queimado | C419: 306 | D419: 3 | E419: 0 | F419: 75 | G419: 0 | H419: 19
A420: =R[-1]C+1 -> 419 | B420: Marmelada | C420: 257 | D420: 0 | E420: 0 | F420: 70 | G420: 4 | H420: 11
A421: =R[-1]C+1 -> 420 | B421: Maxixe, cru | C421: 13 | D421: 1 | E421: 0 | F421: 2 | G421: 2 | H421: 20
A422: =R[-1]C+1 -> 421 | B422: Mel, de abelha | C422: 309 | D422: 0 | E422: 0 | F422: 84 | G422: 0 | H422: 10
A423: =R[-1]C+1 -> 422 | B423: Melado | C423: 296 | D423: 0 | E423: 0 | F423: 76 | G423: 0 | H423: 102
A424: =R[-1]C+1 -> 423 | B424: Melancia, crua | C424: 32 | D424: 0 | E424: 0 | F424: 8 | G424: 0 | H424: 7
A425: =R[-1]C+1 -> 424 | B425: Melão, cru | C425: 29 | D425: 0 | E425: 0 | F425: 7 | G425: 0 | H425: 2
A426: =R[-1]C+1 -> 425 | B426: Merluza, filé, assado | C426: 121 | D426: 26 | E426: 0 | F426: 0 | G426: 0 | H426: 35
A427: =R[-1]C+1 -> 426 | B427: Merluza, filé, cru | C427: 89 | D427: 16 | E427: 2 | F427: 0 | G427: 0 | H427: 20
A428: =R[-1]C+1 -> 427 | B428: Merluza, filé, frito | C428: 191 | D428: 26 | E428: 8 | F428: 0 | G428: 0 | H428: 35
A429: =R[-1]C+1 -> 428 | B429: Mexerica, Murcote, crua | C429: 57 | D429: 0 | E429: 0 | F429: 14 | G429: 3 | H429: 33
A430: =R[-1]C+1 -> 429 | B430: Mexerica, Rio, crua | C430: 36 | D430: 0 | E430: 0 | F430: 9 | G430: 2 | H430: 17
A431: =R[-1]C+1 -> 430 | B431: Milho, amido, cru | C431: 361 | D431: 0 | E431: 0 | F431: 87 | G431: 0 | H431: 1
A432: =R[-1]C+1 -> 431 | B432: Milho, fubá, cru | C432: 353 | D432: 7 | E432: 1 | F432: 78 | G432: 4 | H432: 2
A433: =R[-1]C+1 -> 432 | B433: Milho, verde, cru | C433: 138 | D433: 6 | E433: 0 | F433: 28 | G433: 3 | H433: 1
A434: =R[-1]C+1 -> 433 | B434: Milho, verde, enlatado, drenado | C434: 97 | D434: 3 | E434: 2 | F434: 17 | G434: 4 | H434: 2
A435: =R[-1]C+1 -> 434 | B435: Mingau tradicional, pó | C435: 373 | D435: 0 | E435: 0 | F435: 89 | G435: 0 | H435: 522
A436: =R[-1]C+1 -> 435 | B436: Morango, cru | C436: 30 | D436: 0 | E436: 0 | F436: 6 | G436: 1 | H436: 10
A437: =R[-1]C+1 -> 436 | B437: Mortadela | C437: 268 | D437: 11 | E437: 21 | F437: 5 | G437: 0 | H437: 66
A438: =R[-1]C+1 -> 437 | B438: Mostarda, folha, crua | C438: 18 | D438: 2 | E438: 0 | F438: 3 | G438: 1 | H438: 68
A439: =R[-1]C+1 -> 438 | B439: Nabo, cru | C439: 18 | D439: 1 | E439: 0 | F439: 4 | G439: 2 | H439: 42
A440: =R[-1]C+1 -> 439 | B440: Nêspera, crua | C440: 42 | D440: 0 | E440: 0 | F440: 11 | G440: 2 | H440: 19
A441: =R[-1]C+1 -> 440 | B441: Nhoque, batata, cozido | C441: 180 | D441: 5 | E441: 1 | F441: 36 | G441: 1 | H441: 11
A442: =R[-1]C+1 -> 441 | B442: Noz, crua | C442: 620 | D442: 13 | E442: 59 | F442: 18 | G442: 7 | H442: 105
A443: =R[-1]C+1 -> 442 | B443: Óleo, de babaçu | C443: 884 | D443: 0 | E443: 100 | F443: 0 | G443: 0 | H443: 0
A444: =R[-1]C+1 -> 443 | B444: Óleo, de canola | C444: 884 | D444: 0 | E444: 100 | F444: 0 | G444: 0 | H444: 0
A445: =R[-1]C+1 -> 444 | B445: Óleo, de girassol | C445: 884 | D445: 0 | E445: 100 | F445: 0 | G445: 0 | H445: 0
A446: =R[-1]C+1 -> 445 | B446: Óleo, de milho | C446: 884 | D446: 0 | E446: 100 | F446: 0 | G446: 0 | H446: 0
A447: =R[-1]C+1 -> 446 | B447: Óleo, de pequi | C447: 884 | D447: 0 | E447: 100 | F447: 0 | G447: 0 | H447: 0
A448: =R[-1]C+1 -> 447 | B448: Óleo, de soja | C448: 884 | D448: 0 | E448: 100 | F448: 0 | G448: 0 | H448: 0
A449: =R[-1]C+1 -> 448 | B449: Omelete, de queijo | C449: 268 | D449: 15 | E449: 22 | F449: 0 | G449: 0 | H449: 165
A450: =R[-1]C+1 -> 449 | B450: Ovo, de codorna, inteiro, cru | C450: 176 | D450: 13 | E450: 12 | F450: 0 | G450: 0 | H450: 78
A451: =R[-1]C+1 -> 450 | B451: Ovo, de galinha, clara, cozida/10minutos | C451: 59 | D451: 13 | E451: 0 | F451: 0 | G451: 0 | H451: 6
A452: =R[-1]C+1 -> 451 | B452: Ovo, de galinha, gema, cozida/10minutos | C452: 352 | D452: 15 | E452: 30 | F452: 1 | G452: 0 | H452: 114
A453: =R[-1]C+1 -> 452 | B453: Ovo, de galinha, inteiro, cozido/10minutos | C453: 145 | D453: 13 | E453: 9 | F453: 0 | G453: 0 | H453: 49
A454: =R[-1]C+1 -> 453 | B454: Ovo, de galinha, inteiro, cru | C454: 143 | D454: 13 | E454: 8 | F454: 1 | G454: 0 | H454: 42
A455: =R[-1]C+1 -> 454 | B455: Ovo, de galinha, inteiro, frito | C455: 240 | D455: 15 | E455: 18 | F455: 1 | G455: 0 | H455: 72
A456: =R[-1]C+1 -> 455 | B456: Paçoca, amendoim | C456: 486 | D456: 15 | E456: 26 | F456: 52 | G456: 7 | H456: 22
A457: =R[-1]C+1 -> 456 | B457: Palmito, juçara, em conserva | C457: 23 | D457: 1 | E457: 0 | F457: 4 | G457: 3 | H457: 58
A458: =R[-1]C+1 -> 457 | B458: Palmito, pupunha, em conserva | C458: 29 | D458: 2 | E458: 0 | F458: 5 | G458: 2 | H458: 32
A459: =R[-1]C+1 -> 458 | B459: Pamonha, barra para cozimento, pré-cozida | C459: 171 | D459: 2 | E459: 4 | F459: 30 | G459: 2 | H459: 4
A460: =R[-1]C+1 -> 459 | B460: Pão, aveia, forma | C460: 343 | D460: 12 | E460: 5 | F460: 59 | G460: 5 | H460: 108
A461: =R[-1]C+1 -> 460 | B461: Pão, de queijo, assado | C461: 363 | D461: 5 | E461: 24 | F461: 34 | G461: 0 | H461: 102
A462: =R[-1]C+1 -> 461 | B462: Pão, de queijo, cru | C462: 294 | D462: 3 | E462: 13 | F462: 38 | G462: 0 | H462: 87
A463: =R[-1]C+1 -> 462 | B463: Pão, de soja | C463: 308 | D463: 11 | E463: 3 | F463: 56 | G463: 5 | H463: 90
A464: =R[-1]C+1 -> 463 | B464: Pão, glúten, forma | C464: 252 | D464: 11 | E464: 2 | F464: 44 | G464: 2 | H464: 155
A465: =R[-1]C+1 -> 464 | B465: Pão, milho, forma | C465: 292 | D465: 8 | E465: 3 | F465: 56 | G465: 4 | H465: 77
A466: =R[-1]C+1 -> 465 | B466: Pão, trigo, forma, integral | C466: 253 | D466: 9 | E466: 3 | F466: 49 | G466: 6 | H466: 131
A467: =R[-1]C+1 -> 466 | B467: Pão, trigo, francês | C467: 299 | D467: 7 | E467: 3 | F467: 58 | G467: 2 | H467: 15
A468: =R[-1]C+1 -> 467 | B468: Pão, trigo, sovado | C468: 310 | D468: 8 | E468: 2 | F468: 61 | G468: 2 | H468: 51
A469: =R[-1]C+1 -> 468 | B469: Pastel, de carne, cru | C469: 288 | D469: 10 | E469: 8 | F469: 42 | G469: 1 | H469: 16
A470: =R[-1]C+1 -> 469 | B470: Pastel, de carne, frito | C470: 388 | D470: 10 | E470: 20 | F470: 43 | G470: 0 | H470: 12
A471: =R[-1]C+1 -> 470 | B471: Pastel, de queijo, cru | C471: 308 | D471: 9 | E471: 9 | F471: 45 | G471: 1 | H471: 154
A472: =R[-1]C+1 -> 471 | B472: Pastel, de queijo, frito | C472: 422 | D472: 8 | E472: 22 | F472: 48 | G472: 0 | H472: 126
A473: =R[-1]C+1 -> 472 | B473: Pastel, massa, crua | C473: 310 | D473: 6 | E473: 5 | F473: 57 | G473: 1 | H473: 12
A474: =R[-1]C+1 -> 473 | B474: Pastel, massa, frita | C474: 569 | D474: 6 | E474: 40 | F474: 49 | G474: 1 | H474: 11
A475: =R[-1]C+1 -> 474 | B475: Pé-de-moleque, amendoim | C475: 503 | D475: 13 | E475: 28 | F475: 54 | G475: 3 | H475: 27
A476: =R[-1]C+1 -> 475 | B476: Pepino, cru | C476: 9 | D476: 0 | E476: 0 | F476: 2 | G476: 1 | H476: 9
A477: =R[-1]C+1 -> 476 | B477: Pequi, cru | C477: 204 | D477: 2 | E477: 17 | F477: 12 | G477: 19 | H477: 32
A478: =R[-1]C+1 -> 477 | B478: Pêra, Park, crua | C478: 60 | D478: 0 | E478: 0 | F478: 16 | G478: 2 | H478: 8
A479: =R[-1]C+1 -> 478 | B479: Pêra, Williams, crua | C479: 53 | D479: 0 | E479: 0 | F479: 14 | G479: 3 | H479: 8
A480: =R[-1]C+1 -> 479 | B480: Peru, congelado, assado | C480: 163 | D480: 26 | E480: 5 | F480: 0 | G480: 0 | H480: 13
A481: =R[-1]C+1 -> 480 | B481: Peru, congelado, cru | C481: 93 | D481: 18 | E481: 1 | F481: 0 | G481: 0 | H481: 9
A482: =R[-1]C+1 -> 481 | B482: Pescada, branca, crua | C482: 110 | D482: 16 | E482: 4 | F482: 0 | G482: 0 | H482: 15
A483: =R[-1]C+1 -> 482 | B483: Pescada, branca, frita | C483: 223 | D483: 27 | E483: 11 | F483: 0 | G483: 0 | H483: 378
A484: =R[-1]C+1 -> 483 | B484: Pescada, filé, com farinha de trigo, frito | C484: 283 | D484: 21 | E484: 19 | F484: 5 | G484: 0 | H484: 26
A485: =R[-1]C+1 -> 484 | B485: Pescada, filé, cru | C485: 107 | D485: 16 | E485: 4 | F485: 0 | G485: 0 | H485: 13
A486: =R[-1]C+1 -> 485 | B486: Pescada, filé, frito | C486: 154 | D486: 28 | E486: 3 | F486: 0 | G486: 0 | H486: 10
A487: =R[-1]C+1 -> 486 | B487: Pescada, filé, molho escabeche | C487: 141 | D487: 11 | E487: 8 | F487: 5 | G487: 0 | H487: 20
A488: =R[-1]C+1 -> 487 | B488: Pescadinha, crua | C488: 76 | D488: 15 | E488: 1 | F488: 0 | G488: 0 | H488: 331
A489: =R[-1]C+1 -> 488 | B489: Pêssego, Aurora, cru | C489: 36 | D489: 0 | E489: 0 | F489: 9 | G489: 1 | H489: 3
A490: =R[-1]C+1 -> 489 | B490: Pêssego, enlatado, em calda | C490: 63 | D490: 0 | E490: 0 | F490: 16 | G490: 1 | H490: 4
A491: =R[-1]C+1 -> 490 | B491: Pimentão, amarelo, cru | C491: 27 | D491: 1 | E491: 0 | F491: 5 | G491: 1 | H491: 9
A492: =R[-1]C+1 -> 491 | B492: Pimentão, verde, cru | C492: 21 | D492: 1 | E492: 0 | F492: 4 | G492: 2 | H492: 8
A493: =R[-1]C+1 -> 492 | B493: Pimentão, vermelho, cru | C493: 23 | D493: 1 | E493: 0 | F493: 5 | G493: 1 | H493: 6
A494: =R[-1]C+1 -> 493 | B494: Pinha, crua | C494: 88 | D494: 1 | E494: 0 | F494: 22 | G494: 3 | H494: 20
A495: =R[-1]C+1 -> 494 | B495: Pinhão, cozido | C495: 174 | D495: 2 | E495: 0 | F495: 43 | G495: 15 | H495: 15
A496: =R[-1]C+1 -> 495 | B496: Pintado, assado | C496: 191 | D496: 36 | E496: 3 | F496: 0 | G496: 0 | H496: 113
A497: =R[-1]C+1 -> 496 | B497: Pintado, cru | C497: 91 | D497: 18 | E497: 1 | F497: 0 | G497: 0 | H497: 12
A498: =R[-1]C+1 -> 497 | B498: Pintado, grelhado | C498: 152 | D498: 30 | E498: 2 | F498: 0 | G498: 0 | H498: 68
A499: =R[-1]C+1 -> 498 | B499: Pipoca, com óleo de soja, sem sal | C499: 448 | D499: 9 | E499: 15 | F499: 70 | G499: 14 | H499: 2
A500: =R[-1]C+1 -> 499 | B500: Pitanga, crua | C500: 41 | D500: 0 | E500: 0 | F500: 10 | G500: 3 | H500: 17
A501: =R[-1]C+1 -> 500 | B501: Pitanga, polpa, congelada | C501: 19 | D501: 0 | E501: 0 | F501: 4 | G501: 0 | H501: 7
A502: =R[-1]C+1 -> 501 | B502: Polenta, pré-cozida | C502: 102 | D502: 2 | E502: 0 | F502: 23 | G502: 2 | H502: 1
A503: =R[-1]C+1 -> 502 | B503: Polvilho, doce | C503: 351 | D503: 0 | E503: 0 | F503: 86 | G503: 0 | H503: 27
A504: =R[-1]C+1 -> 503 | B504: Porco, bisteca, crua | C504: 164 | D504: 21 | E504: 8 | F504: 0 | G504: 0 | H504: 6
A505: =R[-1]C+1 -> 504 | B505: Porco, bisteca, frita | C505: 311 | D505: 33 | E505: 18 | F505: 0 | G505: 0 | H505: 69
A506: =R[-1]C+1 -> 505 | B506: Porco, bisteca, grelhada | C506: 280 | D506: 28 | E506: 17 | F506: 0 | G506: 0 | H506: 34
A507: =R[-1]C+1 -> 506 | B507: Porco, costela, assada | C507: 402 | D507: 30 | E507: 30 | F507: 0 | G507: 0 | H507: 16
A508: =R[-1]C+1 -> 507 | B508: Porco, costela, crua | C508: 255 | D508: 18 | E508: 19 | F508: 0 | G508: 0 | H508: 14
A509: =R[-1]C+1 -> 508 | B509: Porco, lombo, assado | C509: 210 | D509: 35 | E509: 6 | F509: 0 | G509: 0 | H509: 19
A510: =R[-1]C+1 -> 509 | B510: Porco, lombo, cru | C510: 175 | D510: 22 | E510: 8 | F510: 0 | G510: 0 | H510: 4
A511: =R[-1]C+1 -> 510 | B511: Porco, orelha, salgada, crua | C511: 258 | D511: 18 | E511: 19 | F511: 0 | G511: 0 | H511: 5
A512: =R[-1]C+1 -> 511 | B512: Porco, pernil, assado | C512: 262 | D512: 32 | E512: 13 | F512: 0 | G512: 0 | H512: 17
A513: =R[-1]C+1 -> 512 | B513: Porco, pernil, cru | C513: 186 | D513: 20 | E513: 11 | F513: 0 | G513: 0 | H513: 12
A514: =R[-1]C+1 -> 513 | B514: Porco, rabo, salgado, cru | C514: 377 | D514: 15 | E514: 34 | F514: 0 | G514: 0 | H514: 21
A515: =R[-1]C+1 -> 514 | B515: Porquinho, cru | C515: 93 | D515: 20 | E515: 0 | F515: 0 | G515: 0 | H515: 25
A516: =R[-1]C+1 -> 515 | B516: Presunto, com capa de gordura | C516: 127 | D516: 14 | E516: 6 | F516: 1 | G516: 0 | H516: 12
A517: =R[-1]C+1 -> 516 | B517: Presunto, sem capa de gordura | C517: 93 | D517: 14 | E517: 2 | F517: 2 | G517: 0 | H517: 23
A518: =R[-1]C+1 -> 517 | B518: Pupunha, cozida | C518: 218 | D518: 2 | E518: 12 | F518: 29 | G518: 4 | H518: 27
A519: =R[-1]C+1 -> 518 | B519: Queijo, minas, frescal | C519: 264 | D519: 17 | E519: 20 | F519: 3 | G519: 0 | H519: 579
A520: =R[-1]C+1 -> 519 | B520: Queijo, minas, meia cura | C520: 320 | D520: 21 | E520: 24 | F520: 3 | G520: 0 | H520: 695
A521: =R[-1]C+1 -> 520 | B521: Queijo, mozarela | C521: 329 | D521: 22 | E521: 25 | F521: 3 | G521: 0 | H521: 875
A522: =R[-1]C+1 -> 521 | B522: Queijo, parmesão | C522: 452 | D522: 35 | E522: 33 | F522: 1 | G522: 0 | H522: 991
A523: =R[-1]C+1 -> 522 | B523: Queijo, pasteurizado | C523: 303 | D523: 9 | E523: 27 | F523: 5 | G523: 0 | H523: 323
A524: =R[-1]C+1 -> 523 | B524: Queijo, petit suisse, morango | C524: 121 | D524: 5 | E524: 2 | F524: 18 | G524: 0 | H524: 730
A525: =R[-1]C+1 -> 524 | B525: Queijo, prato | C525: 359 | D525: 22 | E525: 29 | F525: 1 | G525: 0 | H525: 939
A526: =R[-1]C+1 -> 525 | B526: Queijo, requeijão, cremoso | C526: 256 | D526: 9 | E526: 23 | F526: 2 | G526: 0 | H526: 259
A527: =R[-1]C+1 -> 526 | B527: Queijo, ricota | C527: 139 | D527: 12 | E527: 8 | F527: 3 | G527: 0 | H527: 253
A528: =R[-1]C+1 -> 527 | B528: Quiabo, cru | C528: 29 | D528: 1 | E528: 0 | F528: 6 | G528: 4 | H528: 112
A529: =R[-1]C+1 -> 528 | B529: Quibe, assado | C529: 136 | D529: 14 | E529: 2 | F529: 12 | G529: 1 | H529: 15
A530: =R[-1]C+1 -> 529 | B530: Quibe, cru | C530: 109 | D530: 12 | E530: 1 | F530: 10 | G530: 1 | H530: 12
A531: =R[-1]C+1 -> 530 | B531: Quibe, frito | C531: 253 | D531: 14 | E531: 15 | F531: 12 | G531: 0 | H531: 21
A532: =R[-1]C+1 -> 531 | B532: Quibebe | C532: 86 | D532: 8 | E532: 2 | F532: 6 | G532: 1 | H532: 7
A533: =R[-1]C+1 -> 532 | B533: Quindim | C533: 411 | D533: 4 | E533: 24 | F533: 46 | G533: 3 | H533: 37
A534: =R[-1]C+1 -> 533 | B534: Rabanete, cru | C534: 13 | D534: 1 | E534: 0 | F534: 2 | G534: 2 | H534: 20
A535: =R[-1]C+1 -> 534 | B535: Rapadura | C535: 351 | D535: 0 | E535: 0 | F535: 90 | G535: 0 | H535: 30
A536: =R[-1]C+1 -> 535 | B536: Refrigerante, tipo água tônica | C536: 30 | D536: 0 | E536: 0 | F536: 7 | G536: 0 | H536: 1
A537: =R[-1]C+1 -> 536 | B537: Refrigerante, tipo cola | C537: 33 | D537: 0 | E537: 0 | F537: 8 | G537: 0 | H537: 1
A538: =R[-1]C+1 -> 537 | B538: Refrigerante, tipo guaraná | C538: 38 | D538: 0 | E538: 0 | F538: 10 | G538: 0 | H538: 1
A539: =R[-1]C+1 -> 538 | B539: Refrigerante, tipo laranja | C539: 45 | D539: 0 | E539: 0 | F539: 11 | G539: 0 | H539: 2
A540: =R[-1]C+1 -> 539 | B540: Refrigerante, tipo limão | C540: 39 | D540: 0 | E540: 0 | F540: 10 | G540: 0 | H540: 1
A541: =R[-1]C+1 -> 540 | B541: Repolho, branco, cru | C541: 17 | D541: 0 | E541: 0 | F541: 3 | G541: 1 | H541: 34
A542: =R[-1]C+1 -> 541 | B542: Repolho, roxo, cru | C542: 30 | D542: 1 | E542: 0 | F542: 7 | G542: 1 | H542: 43
A543: =R[-1]C+1 -> 542 | B543: Repolho, roxo, refogado | C543: 41 | D543: 1 | E543: 1 | F543: 7 | G543: 1 | H543: 42
A544: =R[-1]C+1 -> 543 | B544: Romã, crua | C544: 55 | D544: 0 | E544: 0 | F544: 15 | G544: 0 | H544: 4
A545: =R[-1]C+1 -> 544 | B545: Rúcula, crua | C545: 13 | D545: 1 | E545: 0 | F545: 2 | G545: 1 | H545: 116
A546: =R[-1]C+1 -> 545 | B546: Sal, dietético | C546: 0 | D546: 0 | E546: 0 | F546: 0 | G546: 0 | H546: 0
A547: =R[-1]C+1 -> 546 | B547: Sal, grosso | C547: 0 | D547: 0 | E547: 0 | F547: 0 | G547: 0 | H547: 0
A548: =R[-1]C+1 -> 547 | B548: Salada, de legumes, com maionese | C548: 96 | D548: 1 | E548: 7 | F548: 8 | G548: 2 | H548: 12
A549: =R[-1]C+1 -> 548 | B549: Salada, de legumes, cozida no vapor | C549: 35 | D549: 2 | E549: 0 | F549: 7 | G549: 2 | H549: 32
A550: =R[-1]C+1 -> 549 | B550: Salame | C550: 397 | D550: 25 | E550: 30 | F550: 2 | G550: 0 | H550: 87
A551: =R[-1]C+1 -> 550 | B551: Salmão, filé, com pele, fresco, grelhado | C551: 228 | D551: 23 | E551: 14 | F551: 0 | G551: 0 | H551: 28
A552: =R[-1]C+1 -> 551 | B552: Salmão, sem pele, fresco, cru | C552: 169 | D552: 19 | E552: 9 | F552: 0 | G552: 0 | H552: 8
A553: =R[-1]C+1 -> 552 | B553: Salmão, sem pele, fresco, grelhado | C553: 242 | D553: 26 | E553: 14 | F553: 0 | G553: 0 | H553: 15
A554: =R[-1]C+1 -> 553 | B554: Salpicão, de frango | C554: 147 | D554: 13 | E554: 7 | F554: 4 | G554: 0 | H554: 9
A555: =R[-1]C+1 -> 554 | B555: Salsa, crua | C555: 33 | D555: 3 | E555: 0 | F555: 5 | G555: 1 | H555: 179
A556: =R[-1]C+1 -> 555 | B556: Sarapatel | C556: 122 | D556: 18 | E556: 4 | F556: 1 | G556: 0 | H556: 12
A557: =R[-1]C+1 -> 556 | B557: Sardinha, assada | C557: 164 | D557: 32 | E557: 2 | F557: 0 | G557: 0 | H557: 437
A558: =R[-1]C+1 -> 557 | B558: Sardinha, conserva em óleo | C558: 284 | D558: 15 | E558: 24 | F558: 0 | G558: 0 | H558: 550
A559: =R[-1]C+1 -> 558 | B559: Sardinha, frita | C559: 257 | D559: 33 | E559: 12 | F559: 0 | G559: 0 | H559: 482
A560: =R[-1]C+1 -> 559 | B560: Sardinha, inteira, crua | C560: 113 | D560: 21 | E560: 2 | F560: 0 | G560: 0 | H560: 167
A561: =R[-1]C+1 -> 560 | B561: Seleta de legumes, enlatada | C561: 56 | D561: 3 | E561: 0 | F561: 12 | G561: 3 | H561: 16
A562: =R[-1]C+1 -> 561 | B562: Serralha, crua | C562: 30 | D562: 2 | E562: 0 | F562: 4 | G562: 3 | H562: 126
A563: =R[-1]C+1 -> 562 | B563: Shoyu | C563: 60 | D563: 3 | E563: 0 | F563: 11 | G563: 0 | H563: 14
A564: =R[-1]C+1 -> 563 | B564: Soja, extrato solúvel, natural, fluido | C564: 39 | D564: 2 | E564: 1 | F564: 4 | G564: 0 | H564: 16
A565: =R[-1]C+1 -> 564 | B565: Soja, extrato solúvel, pó | C565: 458 | D565: 35 | E565: 26 | F565: 28 | G565: 7 | H565: 359
A566: =R[-1]C+1 -> 565 | B566: Soja, farinha | C566: 403 | D566: 36 | E566: 14 | F566: 38 | G566: 20 | H566: 206
A567: =R[-1]C+1 -> 566 | B567: Soja, queijo (tofu) | C567: 64 | D567: 6 | E567: 3 | F567: 2 | G567: 0 | H567: 80
A568: =R[-1]C+1 -> 567 | B568: Tabule | C568: 57 | D568: 2 | E568: 1 | F568: 10 | G568: 2 | H568: 18
A569: =R[-1]C+1 -> 568 | B569: Tacacá | C569: 46 | D569: 6 | E569: 0 | F569: 3 | G569: 0 | H569: 44
A570: =R[-1]C+1 -> 569 | B570: Taioba, crua | C570: 34 | D570: 2 | E570: 0 | F570: 5 | G570: 4 | H570: 141
A571: =R[-1]C+1 -> 570 | B571: Tamarindo, cru | C571: 275 | D571: 3 | E571: 0 | F571: 72 | G571: 6 | H571: 37
A572: =R[-1]C+1 -> 571 | B572: Tangerina, Poncã, crua | C572: 37 | D572: 0 | E572: 0 | F572: 9 | G572: 0 | H572: 12
A573: =R[-1]C+1 -> 572 | B573: Tangerina, Poncã, suco | C573: 36 | D573: 0 | E573: 0 | F573: 8 | G573: 0 | H573: 4
A574: =R[-1]C+1 -> 573 | B574: Tapioca, com manteiga | C574: 347 | D574: 0 | E574: 10 | F574: 63 | G574: 0 | H574: 30
A575: =R[-1]C+1 -> 574 | B575: Tempero a base de sal | C575: 21 | D575: 2 | E575: 0 | F575: 2 | G575: 0 | H575: 0
A576: =R[-1]C+1 -> 575 | B576: Tomate, com semente, cru | C576: 15 | D576: 1 | E576: 0 | F576: 3 | G576: 1 | H576: 6
A577: =R[-1]C+1 -> 576 | B577: Tomate, extrato | C577: 60 | D577: 2 | E577: 0 | F577: 14 | G577: 2 | H577: 29
A578: =R[-1]C+1 -> 577 | B578: Tomate, molho industrializado | C578: 38 | D578: 1 | E578: 0 | F578: 7 | G578: 3 | H578: 11
A579: =R[-1]C+1 -> 578 | B579: Tomate, purê | C579: 27 | D579: 1 | E579: 0 | F579: 6 | G579: 1 | H579: 13
A580: =R[-1]C+1 -> 579 | B580: Tomate, salada | C580: 20 | D580: 0 | E580: 0 | F580: 5 | G580: 2 | H580: 6
A581: =R[-1]C+1 -> 580 | B581: Torrada, pão francês | C581: 377 | D581: 10 | E581: 3 | F581: 74 | G581: 3 | H581: 18
A582: =R[-1]C+1 -> 581 | B582: Toucinho, cru | C582: 592 | D582: 11 | E582: 60 | F582: 0 | G582: 0 | H582: 2
A583: =R[-1]C+1 -> 582 | B583: Toucinho, frito | C583: 696 | D583: 27 | E583: 64 | F583: 0 | G583: 0 | H583: 9
A584: =R[-1]C+1 -> 583 | B584: Tremoço, cru | C584: 381 | D584: 33 | E584: 10 | F584: 43 | G584: 32 | H584: 176
A585: =R[-1]C+1 -> 584 | B585: Tremoço, em conserva | C585: 120 | D585: 11 | E585: 3 | F585: 12 | G585: 14 | H585: 15
A586: =R[-1]C+1 -> 585 | B586: Tucumã, cru | C586: 262 | D586: 2 | E586: 19 | F586: 26 | G586: 12 | H586: 46
A587: =R[-1]C+1 -> 586 | B587: Tucunaré, filé, congelado, cru | C587: 87 | D587: 17 | E587: 1 | F587: 0 | G587: 0 | H587: 19
A588: =R[-1]C+1 -> 587 | B588: Tucupi, com pimenta-de-cheiro | C588: 27 | D588: 2 | E588: 0 | F588: 4 | G588: 0 | H588: 28
A589: =R[-1]C+1 -> 588 | B589: Umbu, cru | C589: 37 | D589: 0 | E589: 0 | F589: 9 | G589: 1 | H589: 11
A590: =R[-1]C+1 -> 589 | B590: Umbu, polpa, congelada | C590: 33 | D590: 0 | E590: 0 | F590: 8 | G590: 1 | H590: 10
A591: =R[-1]C+1 -> 590 | B591: Uva, Itália, crua | C591: 52 | D591: 0 | E591: 0 | F591: 13 | G591: 0 | H591: 6
A592: =R[-1]C+1 -> 591 | B592: Uva, Rubi, crua | C592: 49 | D592: 0 | E592: 0 | F592: 12 | G592: 0 | H592: 7
A593: =R[-1]C+1 -> 592 | B593: Uva, suco concentrado, envasado | C593: 57 | D593: 0 | E593: 0 | F593: 14 | G593: 0 | H593: 9
A594: =R[-1]C+1 -> 593 | B594: Vaca atolada | C594: 144 | D594: 5 | E594: 9 | F594: 10 | G594: 2 | H594: 62
A595: =R[-1]C+1 -> 594 | B595: Vagem, crua | C595: 24 | D595: 1 | E595: 0 | F595: 5 | G595: 2 | H595: 41
A596: =R[-1]C+1 -> 595 | B596: Vatapá | C596: 254 | D596: 5 | E596: 23 | F596: 9 | G596: 1 | H596: 46
A597: =R[-1]C+1 -> 596 | B597: Virado à paulista | C597: 306 | D597: 10 | E597: 25 | F597: 14 | G597: 2 | H597: 40
A598: =R[-1]C+1 -> 597 | B598: Yakisoba | C598: 112 | D598: 7 | E598: 2 | F598: 18 | G598: 1 | H598: 13